02-01-20,21:40:56,P 2,BDH-02,Buitenbrand container (papiercontainer) Haringkade Duinweg,SGRAVH,157230
02-01-20,21:37:01,P 2,Buitenbrand (INCI-04) Parkzoom Krimpen aan den,IJssel,171231
02-01-20,21:32:44,P 2,Buitenbrand (INCI-03) Omloopdijk,Rotterdam,173731
02-01-20,21:26:20,P 2,Buitenbrand (INCI-02) Mariastraat,Schiedam,170431
02-01-20,21:25:59,P 2,Buitenbrand (INCI-01) Burgemeestersplantsoen,Maassluis,170231
02-01-20,21:21:18,P 2,BDH-17,Aflossen brand Gebroeders Koot & Zn Industrieweg,ZOETMR,155130
02-01-20,21:18:39,P 2,BDH-03,Buitenbrand container (papiercontainer) Willem de Zwijgerlaan Jacob Hopstraat,SGRAVH,157130
02-01-20,21:15:57,P 2,BDH-02,Buitenbrand container (afvalcontainer) Suezkade,SGRAVH,157830
02-01-20,21:14:44,P 2,Buitenbrand (INCI-02) Onbekend Nieuw Beyerlandstraat,Nieuw-Beijerland,185231
02-01-20,21:09:37,P 2,Buitenbrand Kerkstraat,Hellevoetsluis,172561
02-01-20,21:08:45,P 2,Buitenbrand (INCI-01) Oudaenstraat,Rotterdam,170931
02-01-20,20:57:07,P 1,BDH-04,Autom. brand OMS Florence Steenvoorde Generaal Spoorlaan,RIJSZH,157630
02-01-20,20:48:42,P 1,BDH-02,Buitenbrand container Fahrenheitstraat,SGRAVH,157830
02-01-20,20:47:07,P 1,BDH-01,Gebouwbrand woning Woudselaan DENHZH 155550 159591,155530,156030
02-01-20,20:31:53,P 2,Brandgerucht (INCI-04) Sumatraweg,Rotterdam,173431
02-01-20,20:21:25,P 2,BDH-02,Buitenbrand afval/rommel Zandberglaan,SGRAVH,157430
02-01-20,20:15:16,P 2,Buitenbrand (INCI-02) Regenboog,Rhoon,173561
02-01-20,20:06:55,P 2,Brandgerucht (INCI-01) Kritostraat,Rotterdam,173361
02-01-20,19:54:37,P 1,BDH-03,Voertuigbrand Til Brugmanplantsoen,SGRAVH,157630
02-01-20,19:51:46,P 3,Afstemverzoek (Inzet Brw Log & OnS: td / techn. dienst) World Port center Wilhelminakade,Rotterdam,179291
02-01-20,19:43:14,P 2,BDH-02,Buitenbrand afval/rommel MFA Het Lint Achterdijkshoorn,DENHZH,156030
02-01-20,19:43:03,P 1,Autom. brand OMS (INCI-01) Thermen Elysium Kooilaan,Bleiswijk,170831
02-01-20,19:42:20,P 2,BDH-01,Buitenbrand afval/rommel Pluvierstraat,SGRAVH,157130
02-01-20,19:33:51,P 2,Stank/Hinder. Lucht (INCI-05) (riool) (Aantr.: vreemde lucht) Franselaan,Rotterdam,170431
02-01-20,19:27:43,P 2,Brandmelding PAC (INCI-04) Van der Hoevenplein,Rotterdam,170631
02-01-20,19:13:42,P 1,Ass. AMBU (INCI-03) Schiehavenkade,Rotterdam,170631
02-01-20,19:08:14,P 2,BDH-04,Buitenbrand afval/rommel Van Ruysbroekstraat,SGRAVH,157630
02-01-20,19:06:31,P 1,BDH-03,Gebouwbrand industrie Edisonstraat SASSHM,164152,161430
02-01-20,18:48:12,P 1,Ass. AMBU (INCI-02) (Inzet Brw: RV Afhijsen) Platostraat Rotterdam 173751,173361,173731
02-01-20,18:47:08,P 2,BDH-01,Buitenbrand container Sportlaan,PIJNAK,156531
02-01-20,18:36:20,P 1,Ongeval (INCI-01) (Aantr.: gaslucht) Jan Steenstraat,Zwijndrecht,186331
02-01-20,18:20:50,P 2,BDH-04,Buitenbrand Doornstraat,SGRAVH,157130
02-01-20,18:15:31,Proefalarm Avond Brandweer Veiligheidsregio,Rotterdam,Rijnmond.
02-01-20,18:05:22,P 2,BDH-01,Buitenbrand afval/rommel Amerongenstraat Woudenbergstraat,SGRAVH,157630
02-01-20,17:54:44,P 1,BDH-02,Ongeval wegvervoer letsel A12 Li 11,3,ZOETMR,155370
02-01-20,17:53:31,P 1,BDH-03,Ongeval wegvervoer letsel A12 Li 11,7 ZOETMR,159591,155230
02-01-20,17:52:05,P 1,BDH-02,Ongeval wegvervoer letsel A12 Li,11,3,ZOETMR
02-01-20,17:48:07,P 2,Containerbrand (INCI-01) P.C. Hooftstraat,Ridderkerk,173831
02-01-20,17:28:33,P 2,BDH-03,Buitenbrand afval/rommel Westvlietweg,SGRAVH,157430
02-01-20,17:27:16,P 1,BDH-02,Voertuigbrand De la Reyweg,SGRAVH,157830
02-01-20,17:26:54,P 2,BDH-01,Ass. ambu (tilassistentie) van Halewijnplein,VOORB,155130
02-01-20,17:24:11,U bent niet langer actief in de functie Piket_VRR_Communicatie,VRR,Woordvoerders.
02-01-20,17:24:11,U bent nu actief in de functie Piket_VRR_Communicatie,VRR,Woordvoerders.
02-01-20,17:17:07,P 2,BDH-02,Buitenbrand afval/rommel Cantateplein,SGRAVH,157830
02-01-20,17:08:05,P 2,Containerbrand (INCI-01) Prins Alexanderlaan,Rotterdam,171031
02-01-20,17:03:54,P 2,Wateroverlast (INCI-05) Westlandseweg,Vlaardingen,179191
02-01-20,16:55:27,P 2,BDH-08,Wateroverlast Piet Heinstraat,SGRAVH,159670
02-01-20,16:54:48,P 2,Containerbrand (INCI-02) Groeneweg,Bergschenhoek,170761
02-01-20,16:53:52,P 2,BDH-08,Wateroverlast Piet Heinstraat,SGRAVH,157230
02-01-20,16:44:39,P 1,BDH-04,OMS Geverifieerd (brandmelding OMS) Psy Q Lijnbaan,SGRAVH,157830
02-01-20,16:43:12,P 2,BDH-03,Buitenbrand afval/rommel Duivestein Bakenpad,PIJNAK,156531
02-01-20,16:38:12,P 2,BDH-05,Buitenbrand afval/rommel Geestbrugweg,RIJSZH,155630
02-01-20,16:37:30,U bent niet langer actief in de functie,Piket_BRW_Hoofdofficier,2.
02-01-20,16:37:30,U bent nu actief in de functie,Piket_BRW_Hoofdofficier,2.
02-01-20,16:27:01,P 2,Herbez./Kazern. Kazerne Vlaardingen,Vlaardingen,SK03
02-01-20,16:17:50,P 2,Buitenbrand (INCI-02) (Inzet Brw Log & OnS: vz-ah / arbeidshyg) Gorzenweg,Ridderkerk,179201
02-01-20,16:15:46,P 2,Containerbrand (INCI-06) Norma Capelle aan den,IJssel,171131
02-01-20,16:15:16,P 2,Wateroverlast (INCI-04) (Inzet/afst. MO Func: ovdbvz) Jacobis,Lijnbaan,Rotterdam
02-01-20,16:15:05,P 2,Wateroverlast (INCI-05) Marathonweg,Vlaardingen,179233
02-01-20,16:06:56,P 2,BDH-01,Liftopsluiting Gerrit van der Veenlaan,SGRAVH,157630
02-01-20,16:03:20,P 1,BDH-03,Autom. brand OMS Middin Brugsestraat,SGRAVH,157130
02-01-20,15:53:45,P 2,BDH-02,Buitenbrand container Houtzagerssingel,SGRAVH,157830
02-01-20,15:53:45,P 2,Wateroverlast (INCI-05) Prinses Beatrixplantsoen Thorn Prikkerlaan,Rotterdam,171031
02-01-20,15:46:14,P 2,Wateroverlast (INCI-04) Lijnbaan,Rotterdam,170631
02-01-20,15:44:12,P 1,BDH-01,Buitenbrand container Kloosterland,WASSNR,155030
02-01-20,15:38:05,P 2,BDH-06,Buitenbrand container (papiercontainer) Ketelstraat Stuwstraat,SGRAVH,157630
02-01-20,15:28:24,P 1,BDH-04,Autom. brand OMS Villa Vroondaal Nederhoflaan,SGRAVH,156730
02-01-20,15:22:18,P 2,Buitenbrand (INCI-02) Gorzenweg Ridderkerk,173831,186489
02-01-20,15:16:35,P 2,BDH-03,Buitenbrand berm/ruigte Sir Winston Churchillln Prinses Beatrixlaan,RIJSZH,155630
02-01-20,15:13:18,P 2,BDH-17,Aflossen bij Gebroeders Koot & Zn Industrieweg,ZOETMR,156430
02-01-20,15:04:55,P 2,BDH-01,Buitenbrand Springfonteinstraat,SGRAVH,157830
02-01-20,15:01:09,P 1,Autom. brand OMS (:!vervallen!: ) Detentiecentrum Rotterdam,Portelabaan,Rotterdam
02-01-20,15:00:22,P 1,Autom. brand OMS (INCI-02) Detentiecentrum Rotterdam Portelabaan,Rotterdam,170331
02-01-20,14:22:37,P 1,BDH-02,Autom. brand OMS Ewas Childcare Pretoriusstraat,SGRAVH,157830
02-01-20,14:18:01,P 2,Herbez./Kazern. (INCI-01) Kazerne Bosland,Rotterdam,SK11
02-01-20,14:06:54,P 1,BDH-03,Ongeval materieel (Lekkage: gas overig) Holierhoek SCHILD,159592,156130
02-01-20,14:04:16,P 1,Ass. AMBU (INCI-05) (Inzet Brw: aed) Pallieterburg Capelle aan den,IJssel,171031
02-01-20,13:54:03,P 2,Ass. Politie (INCI-03) Autolettestraat mercedesdealer,Rotterdam,179193
02-01-20,13:34:33,P 1,Ass. AMBU (INCI-04) (Inzet Brw: aed) Dwarskulk Hoek van,Holland,170131
02-01-20,13:33:14,P 1,BDH-02,Buitenbrand Hoogveen,SGRAVH,156830
02-01-20,13:31:08,U bent nu actief in de,functie,Piket_HO_HMR.
02-01-20,13:31:07,U bent niet langer actief in de,functie,Piket_HO_HMR.
02-01-20,13:27:03,P 2,Containerbrand (INCI-02) Stormsweg Krimpen aan den,IJssel,171231
02-01-20,13:05:52,P 2,BDH-17,Nacontrole brand Gebroeders Koot & Zn Industrieweg ZOETMR,159630,157750
02-01-20,13:03:31,P 2,Dier in problemen (INCI-01) van Pallandtweg,Middelharnis,174531
02-01-20,13:02:35,P 2,BDH-17,Nacontrole brand (TBO) Gebroeders Koot & Zn,Industrieweg,ZOETMR
02-01-20,12:42:14,P 1,Gebouwbrand (INCI-03) Marijkelaan Dirksland,174331,174231
02-01-20,12:38:33,P 2,BDH-02,Buitenbrand Datheenstraat,SGRAVH,157130
02-01-20,12:37:35,P 2,Buitenbrand (INCI-01) Plein 1940,Vlaardingen,179233
02-01-20,12:33:16,P 2,BDH-03,Dier in problemen Berkenlaan,WASSNR,155150
02-01-20,12:28:52,P 1,BDH-01,Ongeval spoorvervoer Station Voorburg Stationsplein,VOORB,159660
02-01-20,12:25:16,P 2,Containerbrand (INCI-05) Gorzenweg,Ridderkerk,173831
02-01-20,12:21:39,P 2,Liftopsluiting (INCI-04) Dahliastraat,Rotterdam,173431
02-01-20,12:14:31,P 2,Containerbrand (INCI-02) Perzikengaarde Bongerd,Hendrik-Ido-Ambacht,186431
02-01-20,12:08:42,P 2,BDH-17,Nacontrole brand Gebroeders Koot & Zn Industrieweg,ZOETMR,155250
02-01-20,12:01:41,P 2,Dienst aan derden (INCI-03) Lenteakker Spijkenisse,173131,173151
02-01-20,12:01:31,P 1,BDH-03,Buitenbrand Sumatra,ZOETMR,155230
02-01-20,11:59:43,P 1,BDH-02,Gebouwbrand industrie SUEZ Schieweg DELFT 155550 159592,155530,156531
02-01-20,11:53:26,P 1,Buitenbrand (INCI-01) Stormsweg Krimpen aan den,IJssel,171131
02-01-20,11:53:26,P 2,BDH-01,Buitenbrand Abdis Evastraat,SGRAVH,159630
02-01-20,11:49:54,P 2,Buitenbrand (INCI-01) Stormsweg Krimpen aan den,IJssel,171231
02-01-20,11:31:24,P 2,BDH-01,Buitenbrand afval/rommel Tesselsestraat,SGRAVH,157130
02-01-20,11:15:16,P 2,Containerbrand (INCI-01) Kogelvangerstraat,Rotterdam,170631
02-01-20,11:08:48,P 2,BDH-01,Buitenbrand Herenstraat Het Tolland,WATERI,156830
02-01-20,10:58:34,P 2,Containerbrand (INCI-02) Populierendreef,Vlaardingen,179233
02-01-20,10:54:39,P 2,Containerbrand (INCI-01) Tweebosstraat,Rotterdam,173431
02-01-20,10:50:54,P 1,BDH-01,Autom. brand OMS Johannahuis Van Ommerenpark,WASSNR,155030
02-01-20,10:14:16,P 2,Stank/Hinder. Lucht (INCI-01) Van Hallstraat,Schiedam,170431
02-01-20,10:04:24,U bent niet langer actief in de functie Piket,Leiding,MKB.
02-01-20,10:03:16,P 1,BDH-02,Autom. brand OMS Prinsenpassage Blok J in de boogaard Steenvoordela,RIJSZH,155630
02-01-20,09:38:58,P 1,BDH-01,Voertuigbrand Lindelaan,DELFT,155530
02-01-20,09:31:23,PRIO 3,Proefalarm,USAR.NL
02-01-20,09:24:44,U bent nu actief in de,functie,Piket_GMK_MAC.
02-01-20,09:24:42,U bent niet langer actief in de,functie,Piket_GMK_MAC.
02-01-20,09:24:03,U bent nu actief in de functie Piket_GMK_GMK,beheer,.
02-01-20,09:24:03,U bent niet langer actief in de functie Piket_GMK_GMK,beheer,.
02-01-20,09:19:45,U bent niet langer actief in de functie,Piket_VRR_Leider,COPI.
02-01-20,09:19:45,U bent nu actief in de functie,Piket_VRR_Leider,COPI.
02-01-20,09:05:03,U bent niet langer actief in de functie Piket_BRW_Hoofdofficier,1,.
02-01-20,09:05:03,U bent nu actief in de functie Piket_BRW_Hoofdofficier,1,.
02-01-20,08:59:24,U bent niet langer actief in de functie,Piket_VRR_Informatiemanager,COPI.
02-01-20,08:59:24,U bent nu actief in de functie,Piket_VRR_Informatiemanager,COPI.
02-01-20,08:42:33,P 2,BDH-01,Ass. ambu (afhijsen patient) Pelschans ZOETMR,155250,155230
02-01-20,08:31:07,Proefalarm Ochtend Brandweer Veiligheidsregio,Rotterdam,Rijnmond.
02-01-20,08:30:46,Proefalarm Ochtend Brandweer Veiligheidsregio,Rotterdam,Rijnmond.
02-01-20,08:26:22,U bent niet langer actief in de functie Piket_VRR_Regionaal,operationeel,leider.
02-01-20,07:19:08,P 2,BDH-01,Buitenbrand Dokter Bakkerenlaan,NOOTDP,157430
02-01-20,07:14:39,P 2,Dienst aan derden (INCI-02) (Inzet Brw: til assistentie) Rondedans Capelle aan den,IJssel,171031
02-01-20,06:58:42,P 1,Ass. AMBU (INCI-01) Bakkerstraat Rotterdam,173561,173431
02-01-20,06:26:57,P 2,BDH-01,Buitenbrand container Molenbrink,SGRAVH,157730
02-01-20,05:11:27,P 2,Containerbrand (INCI-03) Langeweg,Oostvoorne,172431
02-01-20,05:06:31,P 1,BDH-02,Autom. brand OMS Carlton Beach Hotel Gevers Deynootweg,SGRAVH,157130
02-01-20,05:00:16,P 2,BDH-01,Buitenbrand afval/rommel Kazerne Oosterheem Olof Palmelaan,ZOETMR,155230
02-01-20,04:44:57,P 2,Buitenbrand (INCI-02) Hollandsestraat,Ridderkerk,173831
02-01-20,04:39:18,P 1,CO-melder (INCI-01) Mariastraat,Schiedam,170431
02-01-20,02:49:38,P 2,BDH-03,Buitenbrand Dr. Lelykade,SGRAVH,157130
02-01-20,02:38:16,P 2,Containerbrand (INCI-01) Immobilialaan,Rotterdam,173431
02-01-20,02:29:59,P 1,BDH-02,Buitenbrand afval/rommel Hoefkade,SGRAVH,157830
02-01-20,02:16:07,P 2,BDH-01,Buitenbrand container Kamvaren,SGRAVH,155430
02-01-20,02:02:44,**Herhaalde oproep** Gebouwbrand kantoor Gebroeders Koot & Zn Industrieweg ZOETMR 156882,Aanvulling,VZU
02-01-20,01:29:50,P2 Aflossing zeer grote brand Industrieweg ZOETMR 155250 157850 155330,157230,157430
02-01-20,01:23:46,P 2,BDH-17,Gebouwbrand kantoor (zeer grote brand) Gebroeders Koot & Zn Industrieweg ZOETMR 156882,(Bevoorrading,VZU)
02-01-20,01:16:05,P 1,BDH-03,Buitenbrand Colijnstraat,NAALDW,156430
02-01-20,01:06:29,P 2,BDH-02,Buitenbrand Klaverweide,VOORB,155130
02-01-20,00:39:36,P 2,BDH-17,Gebouwbrand kantoor (zeer grote brand) Gebroeders Koot & Zn Industrieweg ZOETMR,Aanvullen,brandstof
02-01-20,00:37:03,P 1,Ass. AMBU (INCI-03) Oberonweg,Spijkenisse,173131
02-01-20,00:30:57,P 2,Containerbrand (INCI-02) mr. Verschuurstraat,Vlaardingen,179233
02-01-20,00:19:58,P 2,BDH-04,Buitenbrand container (afvalcontainer) Escamplaan Ilpendamstraat,SGRAVH,157730
02-01-20,00:06:31,P 2,BDH-01,Ass. politie Mercuriusweg,SGRAVH,157630
01-01-20,23:39:52,P 1,BDH-02,Brandgerucht De Baanbreker Lijnbaan,ZOETMR,162236
01-01-20,23:29:09,P 2,BDH-04,Buitenbrand Goudenregenstraat Sportlaan,SGRAVH,157130
01-01-20,23:27:09,P 1,BDH-03,Gebouwbrand woning Burgemeester Caan van Necklaan LEIDDM 156450 159591,155130,157430
01-01-20,23:18:31,P 2,Containerbrand (INCI-03) Braamberg Capelle aan den,IJssel,171131
01-01-20,23:03:57,P 1,BDH-03,Ass. ambu (afhijsen patient) Hildebrandstraat SGRAVH,157650,157630
01-01-20,23:01:39,P 1,Brand wegvervoer (INCI-02) Bongweg Hoogvliet,Rotterdam,172131
01-01-20,22:51:24,P 2,Brandgerucht (INCI-01) Bisschopstraat,Rotterdam,170331
01-01-20,22:44:18,P 2,BDH-01,Buitenbrand container (afvalcontainer) Menninckstraat Kranenburgweg,SGRAVH,157130
01-01-20,22:38:37,P 2,BDH-01,Buitenbrand container (afvalcontainer) Kamvaren,SGRAVH,155430
01-01-20,22:30:50,P 1,BDH-03,Buitenbrand berm/ruigte Loenenseplein,SGRAVH,157830
01-01-20,22:27:03,P 2,Buitenbrand afval (INCI-01) Klepperdans Capelle aan den,IJssel,171031
01-01-20,22:17:41,Incident terug naar GRIP 0,Gebouwbrand woning (zeer grote brand) Laan van Wateringse,Veld,SGRAVH
01-01-20,22:10:14,P 2,BDH-02,Buitenbrand container Milieustraat Naaldwijk Hoogwerf,NAALDW,156430
01-01-20,22:07:18,P 2,BDH-01,Buitenbrand container (afvalcontainer) Menninckstraat Dr. Lelykade,SGRAVH,157130
01-01-20,22:04:14,Gaarne,bellen,MKB
01-01-20,21:50:51,Gaarne,bellen,MKB
01-01-20,21:47:55,P 1,BDH-07,Alarm rookmelder Morgenzonlaan,SGRAVH,157830
01-01-20,21:46:38,Bemanning AB gaarne even,bellen,MKB
01-01-20,21:40:50,P 2,Buitenbrand (INCI-02) Strausslaan,Barendrecht,173631
01-01-20,21:39:35,P 1,BDH-06,Ass. ambu (afhijsen patient) Gravendreef SGRAVH,157650,155330
01-01-20,21:39:22,P 1,Ass. AMBU (INCI-03) Ameidestraat,Rotterdam,170431
01-01-20,21:35:20,P 2,BDH-01,Buitenbrand afval/rommel Shetland,ZOETMR,162236
01-01-20,21:21:14,P 2,BDH-02,Buitenbrand container Blauw Glidkruid,SGRAVH,155430
01-01-20,21:16:11,P 1,Gebouwbrand (INCI-01) Baljuwstraat Vlaardingen,170XXX-XXXXXX,170332
01-01-20,21:15:44,P 2,BDH-01,Buitensluiting Anthony Fokkersingel,SGRAVH,156530
01-01-20,21:06:12,P 1,BDH-05,Gebouwbrand woning (GRIP: 1) (zeer grote brand) Laan van Wateringse,Veld,SGRAVH
01-01-20,21:02:24,P 2,Containerbrand (INCI-04) Troelstraplein Thorbeckelaan,Zwijndrecht,186431
01-01-20,20:47:28,P 1,Ass. AMBU (INCI-03) (Inzet Brw: til assistentie) Pimpelmees,Sommelsdijk,174531
01-01-20,20:40:45,P 1,Brand bijgebouw (INCI-01) (Soort bijgebouw: keet/hok/schuurtje) Mr. Troelstrastraat,Ridderkerk,173831
01-01-20,20:38:54,P 2,BDH-02,Buitenbrand afval/rommel van Halewijnplein,VOORB,155130
01-01-20,20:37:57,melding komt,te,vervallen
01-01-20,20:36:58,P 1,Autom. brand OMS (INCI-01) Stichitng Pameijer Kromhoutstraat,Rotterdam,171031
01-01-20,20:32:40,P 2,Stand By,Kazerne,Wateringen
01-01-20,20:31:42,P 2,BDH-01,Buitenbrand afval/rommel De Reaumurstraat,SGRAVH,157830
01-01-20,20:28:58,P 1,Gebouwbrand overig (GRIP: 1) (zeer grote brand) Laan van Wateringse Veld,SGRAVH,157430
01-01-20,20:22:27,P 2,BDH-04,Buitenbrand container Kamvaren,SGRAVH,155430
01-01-20,20:19:37,P 2,BDH-17,met meenemen SOA Gebroeders Koot & Zn Industrieweg,ZOETMR,156970
01-01-20,20:18:33,P 1,BDH-05,Gebouwbrand overig (GRIP: 1) (zeer grote brand) Laan van Wateringse Veld,SGRAVH,156130
01-01-20,20:18:05,P 1,BDH-05,Gebouwbrand overig (GRIP: 1) (zeer grote brand) Laan van Wateringse Veld,SGRAVH,155530
01-01-20,20:14:14,P 1,BDH-05,Gebouwbrand overig (GRIP: 1) (zeer grote brand) Laan van Wateringse Veld SGRAVH,156699,156580
01-01-20,20:13:44,P 2,Containerbrand (INCI-09) Braamberg Capelle aan den,IJssel,171131
01-01-20,20:13:05,P 2,BDH-04,Buitenbrand afval/rommel Jaagpad,WASSNR,155030
01-01-20,20:12:22,P 1,Autom. brand OMS (INCI-08) Parkeergarage NTR 3 Museumpark,Rotterdam,170631
01-01-20,20:10:26,P 2,BDH-03,Buitenbrand container (afvalcontainer) Spaarneplein,SGRAVH,157230
01-01-20,20:08:50,P 2,Containerbrand (INCI-01) Van Noortwijckstraat,Rotterdam,170431
01-01-20,20:06:48,P 1,BDH-17,Gebouwbrand kantoor (GRIP: 0) (zeer grote brand) Gebroeders Koot & Zn Industrieweg,ZOETMR,156680
01-01-20,20:04:34,P 2,Buitenbrand (INCI-06) (Inzet Brw Log & OnS: vz-ah / arbeidshyg) Roteb Service MBS Steenhouwerstraat Hoogvliet,Rotterdam,171693
01-01-20,20:04:01,A1 Laan van Wateringse Veld SGRAVH : (code 10) (stand-by zeer,grote,brand)
01-01-20,19:56:05,P 2,Dienst aan derden (INCI-07) Noorderhoofd Hoek van,Holland,170131
01-01-20,19:55:31,P 1,BDH-05,Gebouwbrand overig (zeer grote brand) Laan van Wateringse Veld SGRAVH 159586 157630 159891,159583,169090
01-01-20,19:52:18,P 1,BDH-05,Gebouwbrand overig (grote brand) Laan van Wateringse Veld,SGRAVH,157650
01-01-20,19:51:05,P 1,BDH-05,Gebouwbrand overig (grote brand) Laan van Wateringse Veld SGRAVH 156882 157730 156930 156760 156780 155481,159020,159590
01-01-20,19:50:09,P 2,Buitenbrand (INCI-05) De Ark Lissabonweg,Vlaardingen,179233
01-01-20,19:49:42,P 2,BDH-04,Buitenbrand afval/rommel Bleekveld,SGRAVH,157230
01-01-20,19:46:01,P 1,BDH-05,Gebouwbrand overig Dublinweg SGRAVH 157750,159593,155630
01-01-20,19:40:53,P 1,BDH-05,Voertuigbrand Dublinweg,SGRAVH,156830
01-01-20,19:32:37,P2 aflossen Industrieweg 5 Zoetermeer,TS,15-6630
01-01-20,19:30:57,P 2,Containerbrand (INCI-08) Provenierssingel,Rotterdam,17INC
01-01-20,19:29:33,P 1,BDH-03,Voertuigbrand Fonteynenburghlaan,VOORB,155630
01-01-20,19:27:33,P 1,BDH-01,Voertuigbrand Forellendaal,SGRAVH,157730
01-01-20,19:21:50,P 2,BDH-04,Buitenbrand container Orinocostroom,ZOETMR,155330
01-01-20,19:21:09,P 2,BDH-02,Stank/Hinder. lucht (vreemde lucht) Verdilaan,MONSTR,156740
01-01-20,19:19:33,P 5,Uitval nutsvoorzieningen,Capellelaan,AMMSTL
01-01-20,19:17:50,P 1,Ass. AMBU (INCI-01) (Inzet Brw: aed) Beverwaardseweg,Rotterdam,173731
01-01-20,19:13:09,P 2,Containerbrand (INCI-08) Van der Sluysstraat,Rotterdam,170631
01-01-20,19:11:12,P 2,Buitenbrand (INCI-07) Sidelingepark,Rotterdam,170431
01-01-20,19:10:50,P 1,Buitenbrand (INCI-06) Roteb Service MBS Steenhouwerstraat Hoogvliet,Rotterdam,172131
01-01-20,19:10:07,P 2,BDH-03,Buitenbrand berm/ruigte Javalaan,ZOETMR,155330
01-01-20,19:08:52,P 2,Liftopsluiting (INCI-05) Christiaan de Wetstraat,Rotterdam,173431
01-01-20,19:00:05,P 2,Liftopsluiting (INCI-04) (Etage: 1) Willem Ruyslaan Student Hotel,Rotterdam,170931
01-01-20,18:57:27,P 2,Buitenbrand (INCI-03) Zeelthof Hoogvliet,Rotterdam,172131
01-01-20,18:55:59,P 2,BDH-05,Buitenbrand afval/rommel Westerbaenstraat,SGRAVH,157230
01-01-20,18:54:42,P 2,BDH-02,Buitenbrand berm/ruigte Oosterschelde,ZOETMR,155330
01-01-20,18:43:20,P 2,BDH-07,Ass. politie Veluwemeer Zuidlaardermeer,ZOETMR,155330
01-01-20,18:41:33,P 1,BDH-06,Buitenbrand afval/rommel De Dreef,SGRAVH,157730
01-01-20,18:29:37,P 2,BDH-05,Buitenbrand container De Reaumurstraat,SGRAVH,157830
01-01-20,18:29:27,P 2,BDH-03,Buitenbrand afval/rommel Spaarneplein Weteringkade,SGRAVH,157230
01-01-20,18:16:10,P 2,BDH-01,Buitenbrand container Moerweg,SGRAVH,157630
01-01-20,18:16:09,P 2,Containerbrand (INCI-01) Borneostraat Billitonlaan,Vlaardingen,179233
01-01-20,18:15:27,Proefalarm Avond Brandweer Veiligheidsregio,Rotterdam,Rijnmond.
01-01-20,18:08:10,P 1,BDH-03,Autom. brand OMS De Thuishaven Neptunusstraat,SGRAVH,157130
01-01-20,18:07:59,P 2,BDH-20,Buitenbrand container (afvalcontainer) Vaassenstraat,SGRAVH,159660
01-01-20,18:06:41,P 2,BDH-02,Buitenbrand container (papiercontainer) Gerard Doggerlaan Oude Polderweg,SGRAVH,157430
01-01-20,17:55:21,P 2,Ass. AMBU (INCI-02) (Inzet Brw: til assistentie) Hofkeslaan,Oudenhoorn,172831
01-01-20,17:47:05,P 2,BDH-01,Liftopsluiting Haagweg,RIJSZH,155630
01-01-20,17:44:52,P 2,BDH-20,Buitenbrand afval/rommel Dassenrade,SGRAVH,159660
01-01-20,17:40:01,P 2,Containerbrand (INCI-01) Blois van Treslongstraat,Vlaardingen,179233
01-01-20,17:24:54,P 2,BDH-01,Buitenbrand afval/rommel Minstreelstraat,SGRAVH,157830
01-01-20,17:14:52,P 2,BDH-20,Buitenbrand afval/rommel Minstreelstraat,SGRAVH,159660
01-01-20,17:13:09,P 2,BDH-03,Ass. ambu (afhijsen patient) Stuwstraat SGRAVH,157650,157630
01-01-20,17:12:20,P 2,BDH-02,Buitenbrand afval/rommel Minstreelstraat,SGRAVH,157630
01-01-20,17:11:29,P 2,BDH-04,Buitenbrand afval/rommel Clubhuis De Burcht Stortenbekerstraat,SGRAVH,157830
01-01-20,17:07:54,P 2,Buitenbrand afval (INCI-01) Bingleystraat,Rotterdam,170631
01-01-20,17:06:39,P 2,BDH-02,Buitenbrand container (afvalcontainer) Pluvierstraat,SGRAVH,157130
01-01-20,17:00:54,P 1,BDH-20,Buitenbrand afval/rommel Stortenbekerstraat,SGRAVH,159660
01-01-20,16:58:11,P 1,BDH-04,Gebouwbrand woning Koningsplein SGRAVH 157850 159591 157830,157230,159660
01-01-20,16:51:35,P 2,BDH-03,Buitenbrand afval/rommel Jules Massenetstraat,SGRAVH,157730
01-01-20,16:51:25,P 2,BDH-09,Buitenbrand afval/rommel Laveibos,ZOETMR,155230
01-01-20,16:50:55,P 2,Containerbrand (INCI-03) (Afval) Groeneweg,Bergschenhoek,170831
01-01-20,16:50:10,P 2,Containerbrand (INCI-02) Houdringeweg,Rotterdam,173731
01-01-20,16:48:54,P 2,BDH-01,Buitenbrand afval/rommel Stortenbekerstraat,SGRAVH,157830
01-01-20,16:38:57,P 1,Handmelder OMS (INCI-04) NS Station T.d.V. Rotterdam Centraal Stationsplein,Rotterdam,170631
01-01-20,16:38:48,P 2,BDH-04,Buitenbrand container Boeierkade,ZOETMR,155230
01-01-20,16:35:33,P 2,BDH-02,Buitenbrand container Prinses Alexialaan,SGRAVH,157430
01-01-20,16:29:11,P 2,Containerbrand (INCI-01) De Damhouderstraat,Rotterdam,170331
01-01-20,16:22:11,P 2,BDH-01,Buitenbrand container Wapserveenstraat,SGRAVH,157730
01-01-20,16:20:22,P 2,Containerbrand (INCI-03) Johann Straussplein,Schiedam,170431
01-01-20,16:16:55,P 1,BDH-20,Ongeval wegvervoer letsel Neherkade Rijswijkseweg,SGRAVH,159660
01-01-20,16:15:39,P 2,Autom. brand OMS (INCI-10) Parkeergarage Argonautenweg,Rotterdam,170331
01-01-20,16:14:37,P 2,BDH-06,Buitenbrand container Mare,PIJNAK,157430
01-01-20,16:12:50,P 2,Liftopsluiting (INCI-09) Kerklaan Capelle aan den,IJssel,171131
01-01-20,16:12:07,P 1,Gebouwbrand (INCI-02) Jacob Catsstraat,Dordrecht,186651
01-01-20,16:00:42,P 2,BDH-05,Buitenbrand Lisztstraat Cornelie van Zantenstraat,SGRAVH,157730
01-01-20,15:58:39,P 2,BDH-04,Ass. ambu (afhijsen patient) Vissendreef ZOETMR,156450,155230
01-01-20,15:57:27,P 2,Buitenbrand (INCI-04) Vincent van Goghlaan Krimpen aan den,IJssel,171231
01-01-20,15:54:16,P 2,BDH-09,Buitenbrand afval/rommel Laveibos,ZOETMR,155230
01-01-20,15:51:50,P 2,Buitenbrand (INCI-03) Volkstuinvereniging Vijfsluizen Schiedamsedijk,Schiedam,170431
01-01-20,15:47:46,P 2,Dier in problemen (INCI-01) Hekelingseweg,Spijkenisse,173131
01-01-20,15:47:33,P 2,BDH-04,Liftopsluiting Waldorpstraat,SGRAVH,157630
01-01-20,15:45:53,P 2,BDH-07,Buitenbrand container Pauwmolen,DELFGW,155530
,01-01-20,15:45:01,Herbezetting,bedankt
01-01-20,15:41:37,P 2,BDH-01,Buitenbrand container Lange Dreef,RIJSZH,155630
01-01-20,15:40:59,P 2,Buitenbrand (INCI-08) Haringvlietplein,Stellendam,174131
01-01-20,15:40:28,P 2,Liftopsluiting (INCI-06) Brede Hilledijk,Rotterdam,173431
01-01-20,15:31:58,Terug naar GRIP 0,Gebouwbrand kantoor (GRIP: 0) (zeer grote brand) Gebroeders Koot & Zn,Industrieweg,ZOETMR
01-01-20,15:31:51,P2 Aflossen Industriesweg,5B,Zoetermeer
01-01-20,15:30:54,P 2,Wateroverlast (INCI-04) Mombassaplaats,Rotterdam,171031
01-01-20,15:25:15,P 2,Containerbrand (INCI-05) (Ops Br: middel) (Inzet Brw Log & OnS: ha,vz-ah / arbeidshyg) Bosland Bergschenhoek,179192,170732
01-01-20,15:24:31,P 2,Containerbrand (INCI-02) Narcisstraat,Zwijndrecht,186331
01-01-20,15:21:50,P2,Aflossen,Zoetermeer
01-01-20,15:20:05,P 2,BDH-05,Buitenbrand container Valkenboskade Copernicuslaan,SGRAVH,157230
01-01-20,15:19:11,P 2,Containerbrand (INCI-05) (Inzet Brw Log & OnS: vz-ah / arbeidshyg,ha) Bosland 35,Bergschenhoek,179201
01-01-20,15:18:16,P 2,BDH-04,Buitenbrand afval/rommel Van Polanenpark,WASSNR,155030
01-01-20,15:12:14,P 2,Containerbrand (INCI-03) (Afval) Harriet Freezerstraat,Spijkenisse,173131
01-01-20,15:11:28,P 2,Containerbrand (INCI-05) (Inzet Brw Log & OnS: ha) Bosland,Bergschenhoek,179184
01-01-20,15:08:24,P 2,BDH-02,Buitenbrand container (afvalcontainer) IKC Klimboom Nesciohove,ZOETMR,155230
01-01-20,15:04:16,P 2,Containerbrand (INCI-04) Hooidrift Ruilstraat,Rotterdam,170631
01-01-20,15:01:02,P 2,BDH-06,Buitenbrand container Van Ostadestraat Jacob Catsstraat,SGRAVH,157830
01-01-20,14:59:29,P 2,Containerbrand (INCI-05) Bosland,Bergschenhoek,170731
01-01-20,14:58:57,P 2,BDH-05,Buitenbrand container (papiercontainer) Belgischeplein,SGRAVH,157230
01-01-20,14:58:37,P 2,Wateroverlast (INCI-01) Fresiastraat,Ridderkerk,173831
01-01-20,14:53:09,P 2,Containerbrand (INCI-05) Bosland,Bergschenhoek,170761
01-01-20,14:49:29,P 2,Containerbrand (INCI-02) Desdemonastraat Fideliolaan Hoogvliet,Rotterdam,172131
01-01-20,14:43:29,P 2,BDH-07,Buitenbrand container Malta,ZOETMR,155230
01-01-20,14:41:59,P 1,Buitenbrand (INCI-01) Lindenlaan Berkel en,Rodenrijs,170761
01-01-20,14:41:22,P 2,BDH-01,Liftopsluiting Van Boecopkade,SGRAVH,157830
01-01-20,14:38:46,P 2,BDH-04,Buitenbrand container Markensestraat,SGRAVH,157230
01-01-20,14:35:54,Terug naar GRIP 1,Gebouwbrand kantoor (GRIP: 1) (zeer grote brand) Gebroeders Koot & Zn,Industrieweg,ZOETMR
01-01-20,14:35:52,P 2,Containerbrand (INCI-06) (Papier) Neptunusstraat,Rotterdam,173561
01-01-20,14:35:37,P 1,Dienst aan derden (INCI-08) van Beethovensingel,Vlaardingen,179233
