23-12-19,11:01:09,P 1,BDH-04,Autom. brand OMS Tehuis Beukenhof Jan Thijssenweg,RIJSZH,157630
23-12-19,10:52:20,P 2,BDH-02,Liftopsluiting Xindao Verrijn Stuartlaan,RIJSZH,155630
23-12-19,10:47:31,P 2,BDH-01,Dienstverlening Verzorgingshuis Tabitha Mozartlaan,SGRAVH,157730
23-12-19,10:40:00,U bent niet langer actief in de functie Piket CC,Goeree,Overflakkee.
23-12-19,10:40:00,U bent nu actief in de functie Piket CC,Goeree,Overflakkee.
23-12-19,10:21:00,U bent nu actief in de functie Piket_GHOR_Hoofd,Actie,Centrum.
23-12-19,10:21:00,U bent niet langer actief in de functie Piket_GHOR_Hoofd,Actie,Centrum.
23-12-19,10:20:20,langer actief in de functie Piket_VRR_Ondersteuner sectie,communicatie,.
23-12-19,10:20:19,U,bent,niet
23-12-19,10:20:19,U bent nu actief in de functie Piket_VRR_Ondersteuner sectie,communicatie,.
23-12-19,10:19:01,Het scenario SGBO Proefalarm is geactiveerd! U wordt benaderd door SMART Respond of u kunt inbellen,via,0XXXXXXXXX.
23-12-19,10:17:22,Het scenario SGBO Proefalarm is geactiveerd! U wordt benaderd door SMART Respond of u kunt inbellen,via,0XXXXXXXXX.
23-12-19,09:54:59,P 1,Ass. AMBU (INCI-02) Cipressendreef,Vlaardingen,179232
23-12-19,09:45:19,U bent nu actief in de functie Piket_GHOR_Operationeel Directeur,GHOR,.
23-12-19,09:31:04,P 2,Liftopsluiting (INCI-02) Burgemeester Stulemeijerlaan,Schiedam,170431
23-12-19,09:17:45,P 2,Schip/watersp. in problemen (INCI-01) (Inzet Brw CO&VB: Drone Gezagvoerder,Droneteam) Reddingsbrigade Maasvlakte Strand Geel Maasvlakte Rotterdam,171682,171692
23-12-19,09:17:05,P 2,Schip/watersp. in problemen (INCI-01) Reddingsbrigade Maasvlakte Strand Geel Maasvlakte,Rotterdam,179195
23-12-19,09:01:18,P 1,Ass. AMBU (INCI-02) Maasveld Maashaven O.z.,Rotterdam,173431
23-12-19,08:58:27,P 1,BDH-02,Alarm rookmelder Kruidenlaan,WATERI,156830
23-12-19,08:55:18,P 2,Schip/watersp. in problemen (INCI-01) Reddingsbrigade Maasvlakte Strand Geel Maasvlakte,Rotterdam,RKJ111
23-12-19,08:50:22,P 2,Schip/watersp. in problemen (INCI-01) Reddingsbrigade Maasvlakte Strand Geel Maasvlakte Rotterdam,KNRM7818,171331
23-12-19,08:47:03,P 2,BDH-01,Dier te water Vulcanusweg Minervaweg,DELFT,159610
23-12-19,08:44:31,P 1,BDH-20,Ongeval wegvervoer letsel,Spinozalaan,VOORB
23-12-19,08:35:01,P 2,BDH-01,Dier te water Vulcanusweg Minervaweg,DELFT,155530
23-12-19,08:33:37,U bent nu actief in de functie Piket_Coordinator,Drone,Team.
23-12-19,08:33:35,U bent niet langer actief in de functie Piket_Coordinator,Drone,Team.
23-12-19,08:30:59,Proefalarm Ochtend Brandweer Veiligheidsregio,Rotterdam,Rijnmond.
23-12-19,08:20:35,U bent nu actief in de functie,Piket_VRR_Informatiemanager,ROT.
23-12-19,08:16:36,U bent nu actief in de functie Piket_GHOR_Operationeel medewerker,actiecentrum,.
23-12-19,08:16:36,U bent niet langer actief in de functie Piket_GHOR_Operationeel medewerker,actiecentrum,.
23-12-19,08:10:36,Communicatie,VRR,Woordvoerders.
23-12-19,08:10:36,U bent nu actief in de,functie,Piket_VRR_
23-12-19,08:10:36,U bent niet langer actief in de functie Piket_VRR_Communicatie,VRR,Woordvoerders.
23-12-19,08:09:38,U bent niet langer actief in de functie Piket_BRW_Tactisch Officier,Alarmcentrale,.
23-12-19,08:09:38,U bent nu actief in de functie Piket_BRW_Tactisch Officier,Alarmcentrale,.
23-12-19,07:52:15,U bent nu actief in de functie Piket,TCO,Coordinator.
23-12-19,07:52:15,U bent niet langer actief in de functie Piket,TCO,Coordinator.
23-12-19,07:29:24,P 3,Afstemverzoek (INCI-01) (Inzet Brw Log & OnS: vz-ah / arbeidshyg) World Port center Wilhelminakade,Rotterdam,179201
23-12-19,03:44:35,P 1,Brand wegvervoer (INCI-02) Machiniststraat,Rotterdam,170631
23-12-19,03:37:18,P 1,BDH-03,Voertuigbrand Walnootstraat Oude Haagweg,SGRAVH,157730
23-12-19,03:18:40,P 2,BDH-02,Buitenbrand Markensestraat,SGRAVH,157130
23-12-19,03:03:58,P 1,BDH-01,Gebouwbrand industrie Vrederustlaan DELFGW 155550 159591,155430,155530
23-12-19,02:57:09,P 1,Gebouwbrand woning (INCI-01) Hertenburg Barendrecht 173451 173361,173431,173631
23-12-19,02:15:35,P 1,Brandgerucht (INCI-01) 't Hooge Dorp Groenedijk Capelle aan den,IJssel,171131
23-12-19,00:51:54,P 1,Ass. AMBU (INCI-02) (Inzet Brw: aed) Prinsendijk,Rotterdam,173731
23-12-19,00:47:43,P 3,Autom. brand OMS (:!vervallen!: ) Park Medisch Centrum,Hoofdweg,Rotterdam
23-12-19,00:46:07,P 1,Autom. brand OMS (INCI-02) Park Medisch Centrum Hoofdweg,Rotterdam,171031
23-12-19,00:37:01,P 1,BDH-01,Voertuig te water Hoenderparklaan Hooghe Beer KWINTH 159610 157810 157750 156970 159591 156830 157489,157487,157480
23-12-19,00:20:10,P 2,Nacontrole graag,melden,BVnet-23
22-12-19,23:56:14,P 1,Nacontrole (INCI-03) Mgr Nolenslaan,Schiedam,170431
22-12-19,23:51:11,P 2,Buitenbrand (INCI-02) Schans Wijdesteeg,Rotterdam,170631
22-12-19,23:38:25,P 1,Ass. AMBU (INCI-01) (Inzet Brw: aed) Aernt Bruunstraat,Rotterdam,171031
22-12-19,23:02:41,P 1,Ass. AMBU (INCI-02) (Inzet Brw: aed) Kastanjestraat Berkel en,Rodenrijs,170XXX-XXXXXX
22-12-19,22:48:01,P 2,Dienst aan derden (INCI-01) HAP Spijkenisse Ruwaard van Puttenweg,Spijkenisse,17INC
22-12-19,22:44:41,P 2,Dienst aan derden (Inzet Brw Alg EH: TS) HAP Spijkenisse Ruwaard van Puttenweg,Spijkenisse,173131
22-12-19,22:11:58,P 2,Containerbrand (INCI-01) Cervantesstraat,Rotterdam,173361
22-12-19,22:08:20,P 2,BDH-04,Buitenbrand afval/rommel Bartholomeuslaan,NOOTDP,157430
22-12-19,22:01:46,P 2,BDH-03,Buitenbrand Burgemeester Hovylaan,SGRAVH,157730
22-12-19,21:27:40,P 1,BDH-01,Gebouwbrand woning (middelbrand) Zijldijk LEIDDP 169192,169199,164330
22-12-19,21:13:29,P 1,BDH-02,Stank/Hinder. lucht (gaslucht) Betje Wolffstraat,SGRAVH,157650
22-12-19,21:10:22,P 1,BDH-02,Stank/Hinder. lucht (gaslucht) Betje Wolffstraat,SGRAVH,157630
22-12-19,20:48:12,P 1,Ass. AMBU (INCI-02) (Inzet Brw: aed) Zilverdistel,Rotterdam,171031
22-12-19,20:33:35,P 2,BDH-02,Buitenbrand (papiercontainer) Oude Polderweg,SGRAVH,157430
22-12-19,20:09:54,P 2,BDH-01,Buitenbrand afval/rommel Van Ruysbroekstraat Coornhertstraat,SGRAVH,157630
22-12-19,19:50:42,P 2,BDH-05,Buitenbrand Laan van Wateringse Veld,SGRAVH,157730
22-12-19,19:32:46,P 1,BDH-04,Stank/Hinder. lucht (gaslucht) Cornelis van der Lijnstraat,SGRAVH,155130
22-12-19,19:25:44,P 2,BDH-03,Buitenbrand Erasmusweg,SGRAVH,157630
22-12-19,19:18:35,P 1,Gebouwbrand cel (INCI-02) Basisteambureau 63 Drechtsteden-Binnen,Overkampweg,Dordrecht
22-12-19,19:17:24,P 1,Gebouwbrand cel (INCI-02) Cellencomplex Overkampweg Overkampweg Dordrecht 186651 189492 189821,179081,186632
22-12-19,18:47:16,P 1,Ongeval (INCI-01) (Aantr.: gaslucht) Mariniersweg Rotterdam,179192,170931
22-12-19,18:13:12,P 1,Gebouwbrand woning (INCI-03) Boogjes Dordrecht 186651,186532,186632
22-12-19,18:03:46,P 1,Gebouwbrand (INCI-02) Monteverdistraat Capelle aan den IJssel 171151,171131,170931
22-12-19,17:39:05,P 1,BDH-01,Scheepvaartbrand Tango 't Haantje Prinses Beatrixlaan,DELFT,155530
22-12-19,17:37:52,P 2,Containerbrand (INCI-01) Daltonstraat,Schiedam,170431
22-12-19,17:37:09,P 2,BDH-08,Liftopsluiting Beeklaan,SGRAVH,157230
22-12-19,17:27:22,U bent niet langer actief in de functie Piket,CC,Voorne.
22-12-19,17:27:22,U bent nu actief in de functie Piket,CC,Voorne.
22-12-19,17:12:27,P 2,BDH-10,Wateroverlast Bierkade,SGRAVH,159635
22-12-19,17:11:20,P 2,BDH-09,Buitenbrand Hackfortstraat,SGRAVH,157630
22-12-19,16:37:57,P 2,BDH-01,Stormschade Voorhamstraat,ZOETMR,155250
22-12-19,16:29:07,P 1,Ongeval (INCI-05) (Aantr.: gaslucht) van der Waalsstraat Vlaardingen,179191,179232
22-12-19,16:21:57,P 1,Ass. AMBU (INCI-02) (Inzet Brw: aed) Merwedestraat Rozenburg,ZH,171931
22-12-19,16:17:46,P 2,Containerbrand (INCI-01) Treil Hoogvliet,Rotterdam,172131
22-12-19,15:58:29,P 2,Buitenbrand (INCI-04) Vondelweg,Rotterdam,170931
22-12-19,15:56:09,P 1,BDH-06,Gebouwbrand woning Suze Robertsonstraat SGRAVH 157650 159591,157630,159635
22-12-19,15:46:33,P 2,Containerbrand (INCI-03) (Afval) Dempostraat,Rotterdam,170631
22-12-19,15:39:03,P 1,BDH-03,Autom. brand OMS Ingang E Fresh Liguster,LEIDDM,155130
22-12-19,15:13:41,U bent nu actief in de functie Piket_VRR_Hoofd,sectie,communicatie.
22-12-19,15:13:41,U bent niet langer actief in de functie Piket_VRR_Hoofd,sectie,communicatie.
22-12-19,15:00:01,P 2,BDH-04,Buitenbrand afval/rommel Vreugd en Rust,VOORB,155130
22-12-19,14:48:42,P 2,BDH-03,Nacontrole brand Fregatwerf,ZOETMR,155230
22-12-19,14:41:39,P 1,BDH-02,Gebouwbrand industrie I.S.W Madeweg Madeweg MONSTR 157750 159591,156730,157730
22-12-19,14:40:22,P 2,CO-melder (INCI-02) Diephuisstraat,Rotterdam,170331
22-12-19,14:10:03,vervallen Handmelder OMS Middin Willem,Beukelszoonstraat,Vlaardingen
22-12-19,14:08:33,P 1,Handmelder OMS (INCI-03) Middin Willem Beukelszoonstraat,Vlaardingen,179232
22-12-19,14:07:29,P 2,BDH-01,Ass. politie Pensioen Opleidingen Zeestraat,SGRAVH,157810
22-12-19,14:05:37,P 1,Autom. brand OMS (INCI-02) World Port center Wilhelminakade,Rotterdam,170631
22-12-19,13:53:12,P 2,BDH-01,Ass. politie Pensioen Opleidingen Zeestraat,SGRAVH,157230
22-12-19,13:43:22,P 1,BDH-02,Autom. brand OMS Hotel Royal Bridges Koornmarkt,DELFT,155530
22-12-19,13:22:16,P 1,Ass. AMBU (INCI-01) (Inzet Brw: aed) Antes Delta Kliniek A Albrandswaardsedijk,Poortugaal,179194
22-12-19,13:19:22,P 1,Ass. AMBU (INCI-01) (Inzet Brw: aed) Antes Delta Kliniek A Albrandswaardsedijk,Poortugaal,173231
22-12-19,13:02:27,P 2,BDH-01,Dienstverlening Huisartsenpost Zoetermeer Toneellaan,ZOETMR,155370
22-12-19,12:55:46,P 2,Containerbrand (INCI-03) Olympiaweg,Rotterdam,173731
22-12-19,12:22:07,P 1,BDH-01,Autom. brand OMS Woodstock Om-en-Bij,SGRAVH,157830
22-12-19,12:13:53,P 2,Gaarne,bellen,MKB
22-12-19,11:55:59,P 1,BDH-01,Autom. brand OMS Gem.Leidschendam-Voorburg Koningin Wilhelminalaan,LEIDDM,155130
22-12-19,11:43:31,P 1,BDH-05,Dier te water Zouteveenseweg,SCHILD,156030
22-12-19,11:28:29,P 2,BDH-03,Wateroverlast Rodelaan,VOORB,159670
22-12-19,11:24:20,P 1,BDH-05,Dier te water Zouteveenseweg,SCHILD,156970
22-12-19,11:17:57,P 1,BDH-05,Dier te water Zouteveenseweg,SCHILD,156130
22-12-19,11:09:39,P 2,BDH-04,Dienstverlening Politie steunpunt Zichtenburglaan Zichtenburglaan,SGRAVH,157770
22-12-19,11:02:39,P 2,Liftopsluiting (INCI-01) Purmerhoek Capelle aan den,IJssel,171131
22-12-19,10:58:08,P 2,BDH-03,Wateroverlast Rodelaan,VOORB,159670
22-12-19,10:42:12,P 1,Autom. brand OMS (INCI-02) Laurens Eksterstraat,Rotterdam,173431
22-12-19,10:24:41,P 2,BDH-01,Verontreiniging oppervl.water Alexander Gogelweg R. J. Schimmelpennincklaan,SGRAVH,157230
22-12-19,09:47:14,P 2,BDH-06,Stormschade Schelfhout,MONSTR,156730
22-12-19,09:28:05,P 2,BDH-01,Wateroverlast Plaats,SGRAVH,157230
22-12-19,09:18:50,P 3,Afstemverzoek (INCI-01) 17 04 Schiedam 's-Gravelandseweg,Schiedam,179201
22-12-19,08:56:50,P 2,Dier in problemen (INCI-01) Wolvenburg,Barendrecht,173361
22-12-19,08:41:05,P 2,BDH-04,Dier te water Van Ruyvenlaan,POELDK,156730
22-12-19,08:31:59,P 2,BDH-02,Wateroverlast Ackershof,PIJNAK,155430
22-12-19,08:30:57,Proefalarm Ochtend Brandweer Veiligheidsregio,Rotterdam,Rijnmond.
22-12-19,08:30:39,Proefalarm Ochtend Brandweer Veiligheidsregio,Rotterdam,Rijnmond.
22-12-19,08:24:52,P 1,BDH-02,Autom. brand OMS Berkenhof Terracottastraat,RIJSZH,155630
22-12-19,08:23:12,P 1,BDH-01,Ass. ambu (afhijsen patient) Europalaan NWKKIJ,171151,163731
22-12-19,06:09:27,P 2,Buitenbrand (INCI-02) Puccinistraat,Schiedam,170431
22-12-19,05:42:12,P 2,Herbez./Kazern. (INCI-01) Kazerne Frobenstraat,Rotterdam,SK05
22-12-19,05:13:15,P 1,Gebouwbrand woning (INCI-03) (scooter) Prins Bernhardkade,Rotterdam,170XXX-XXXXXX
22-12-19,05:12:48,P 1,BDH-03,Autom. brand OMS Holland PTC Huismansingel,DELFT,155530
22-12-19,05:08:01,P 2,BDH-01,Buitenbrand container De Wielepet Heijdseweg,MONSTR,156730
22-12-19,05:05:40,P 1,Brand wegvervoer (INCI-03) (scooter) Prins Bernhardkade,Rotterdam,170331
22-12-19,04:53:27,P 1,Ass. AMBU (INCI-02) (Inzet Brw: aed) Franselaan,Rotterdam,170431
22-12-19,04:09:03,P 1,Ass. AMBU (INCI-01) (Inzet Brw: aed) Ericaplein,Rotterdam,173431
22-12-19,04:02:14,P 1,BDH-02,Autom. brand OMS Parnassia Monsterseweg,SGRAVH,157730
22-12-19,03:52:05,P 1,BDH-01,Voertuigbrand Doornstraat,SGRAVH,157130
22-12-19,02:16:16,P 1,BDH-03,Voertuigbrand Havenkade,SGRAVH,157130
22-12-19,02:07:27,P 1,Buitenbrand,Pastoorswarande,SGRAVH
22-12-19,02:06:39,P 2,BDH-02,Buitenbrand Pastoorswarande,SGRAVH,157830
22-12-19,01:40:24,P 1,BDH-01,Gebouwbrand woning Van Aalstlaan ZOETMR 155250 159591,155330,155230
22-12-19,01:20:35,P 2,Rookmelder (INCI-02) Librijesteeg,Rotterdam,170931
22-12-19,00:49:37,P 1,Ongeval (INCI-01) (Lekkage Gev stof: koolmonoxide/co) Bree Rotterdam,179194,173431
22-12-19,00:23:24,P 2,BDH-02,Nacontrole brand Adriana van Roonlaan,SGRAVH,157730
22-12-19,00:22:07,P 1,Gebouwbrand woning (INCI-02) Wiekstraat Rotterdam,170951,170XXX-XXXXXX
22-12-19,00:15:05,P 2,BDH-01,Buitenbrand Wesselsstraat,SGRAVH,157830
22-12-19,00:05:03,P 1,BDH-03,Autom. brand OMS Parnassia Psycho-medisch centrum Avocadostraat,SGRAVH,157730
21-12-19,23:56:15,P 2,BDH-03,Stank/Hinder. lucht J.J. Heggekade,SGRAVH,157750
21-12-19,23:52:31,P 1,BDH-03,Stank/Hinder. lucht J.J. Heggekade SGRAVH,159591,157730
21-12-19,23:48:44,P 2,BDH-02,Ass. politie Goudriaankade Rijswijkseweg,SGRAVH,157630
21-12-19,23:34:41,P 1,Gebouwbrand woning (INCI-01) Hoogvlietsekerksingel Hoogvliet Rotterdam 173151,172131,173231
21-12-19,23:27:09,P 2,BDH-01,Buitenbrand Arubastraat Floresstraat,DELFT,155530
21-12-19,23:10:03,P 1,Ass. AMBU (INCI-02) (Inzet Brw: aed) Waaierdans Capelle aan den,IJssel,171031
21-12-19,22:42:37,P 3,Autom. brand OMS (:!vervallen!: ) Zuidwester ( Hernesseroort ),Oosthavendijk,Middelharnis
21-12-19,22:41:24,P 3,Autom. brand OMS Zuidwester ( Hernesseroort ),Oosthavendijk,Middelharnis
21-12-19,22:39:56,P 1,Autom. brand OMS (INCI-02) Zuidwester ( Hernesseroort ) Oosthavendijk,Middelharnis,174531
21-12-19,22:25:05,P 2,BDH-01,Buitenbrand container Tesselsestraat,SGRAVH,157130
21-12-19,21:55:14,telef.MKB Ass. Politie (Inzet/afst. MO Func: ovdbvz) vv Rockanje,Korteweg,Rockanje
21-12-19,21:36:04,U bent nu actief in de functie Piket_VRR_Ondersteuner sectie,communicatie,.
21-12-19,21:36:04,U bent niet langer actief in de functie Piket_VRR_Ondersteuner sectie,communicatie,.
21-12-19,21:30:25,P 2,Brand wegvervoer (INCI-02) (aanhanger) Fazantstraat,Sommelsdijk,174532
21-12-19,21:17:29,VERVALLEN!!! Voertuig te water (personenauto),Oudelandsedijk,Middelharnis
21-12-19,21:13:50,P 1,Voertuig te water (INCI-03) (personenauto) Oudelandsedijk,Middelharnis,174831
21-12-19,21:11:33,P 2,Herbez./Kazern. (INCI-04) Kazerne Spijkenisse,Spijkenisse,SK31
21-12-19,21:08:33,P 1,Voertuig te water (INCI-03) (personenauto) Oudelandsedijk Middelharnis 174431 173111 172551,179197,174531
21-12-19,20:24:26,P 2,Containerbrand (INCI-02) Nieuwe Damlaan,Schiedam,170431
21-12-19,20:19:26,P 1,BDH-02,Nacontrole brand Wenckebachstraat,SGRAVH,157630
21-12-19,20:05:58,P 2,Buitenbrand (INCI-03) Ogierssingel Mr. Arend van der Woudenslaan,Rotterdam,173361
21-12-19,20:02:57,P 1,BDH-03,Gebouwbrand woning Volendamlaan SGRAVH 157750 159591,157730,157630
21-12-19,19:20:37,P 2,BDH-05,Buitenbrand container Van Damstraat,SGRAVH,157830
21-12-19,19:08:56,P 2,Brandgerucht (INCI-02) Brederodestraat,Bergschenhoek,170761
21-12-19,18:49:05,P 2,BDH-04,Liftopsluiting Watervogelstraat,SGRAVH,157430
21-12-19,18:38:21,P 2,BDH-02,Buitenbrand afval/rommel Damasstraat,SGRAVH,157630
21-12-19,18:31:41,P 2,Stank/Hinder. Lucht (INCI-03) (Inzet/afst. Brw Func: OvDB) (benzinelucht) (Aantr.: vreemde lucht) (benzine) Kopspoor Capelle aan den,IJssel,179193
21-12-19,18:30:16,P 1,BDH-01,Voertuigbrand Klaroenstraat,RIJSZH,155630
21-12-19,18:15:40,Proefalarm Avond Brandweer Veiligheidsregio,Rotterdam,Rijnmond.
21-12-19,18:14:48,P 1,Ongeval Binnen Letsel (INCI-05) (Inzet Brw: RV Afhijsen) Zandkreek Rotterdam,173751,173731
21-12-19,18:14:45,P 2,Stank/Hinder. Lucht (INCI-03) (Aantr.: vreemde lucht) (benzine) Kopspoor Capelle aan den,IJssel,171031
21-12-19,18:09:33,P 2,Liftopsluiting (INCI-02) Den Uylsingel,Rotterdam,171131
21-12-19,18:09:18,P 1,BDH-03,Ass. ambu (afhijsen patient) Eendendaal NWKKIJ 171151,169194,163731
21-12-19,18:06:01,P 1,BDH-02,Ass. politie Mercuriusweg,SGRAVH,157630
21-12-19,17:54:40,vervallen!!!! Ongeval Binnen Letsel,Zandkreek,Rotterdam
21-12-19,17:53:44,P 1,Ongeval Binnen Letsel (INCI-04) Zandkreek Rotterdam,179194,173731
21-12-19,17:42:29,P 1,BDH-01,Autom. brand OMS De Nederhof Hofstraat,HONSDK,156630
21-12-19,17:30:10,P 2,Buitenbrand (INCI-02) Melanchtonpark (Recr),Rotterdam,170331
21-12-19,16:58:49,P 1,Ongeval (INCI-04) (Inzet Brw: til assistentie) Plein 1940,Rotterdam,170951
21-12-19,16:58:03,P 1,Ongeval (INCI-04) (Inzet Brw: til assistentie) Plein 1940,Rotterdam,170631
21-12-19,16:33:25,P 2,BDH-04,Dier op hoogte Copernicusstraat,SGRAVH,157830
21-12-19,16:30:21,P 1,Autom. brand OMS (INCI-02) Leger Des Heils Terbregseweg,Rotterdam,171031
21-12-19,16:25:14,P 2,BDH-03,Buitenbrand container Radijsstraat,WATERI,156831
21-12-19,16:19:44,P 2,BDH-02,Buitenbrand container (afvalcontainer) Slachthuisplein,SGRAVH,157630
21-12-19,16:13:19,U bent niet langer actief in de functie Piket_VRR_Ondersteuner sectie,communicatie,.
21-12-19,16:13:19,U bent nu actief in de functie Piket_VRR_Ondersteuner sectie,communicatie,.
21-12-19,16:00:57,P 2,BDH-01,Ass. ambu (afhijsen patient) Pomonaplein SGRAVH,157750,157730
21-12-19,15:46:37,P 2,Brandgerucht (INCI-01) Helinium Fazantenlaan,Hellevoetsluis,172561
21-12-19,15:37:22,P 2,Buitenbrand berm (INCI-03) Mercon Montage BV. West Kinderdijk,Alblasserdam,186732
21-12-19,15:08:00,P 2,BDH-03,Wateroverlast Bouwlocatie Arcade Wonen Kranenburgweg,SGRAVH,157130
21-12-19,15:07:18,P 1,BDH-02,CO-melder Enschedelaan SGRAVH,159591,157630
21-12-19,15:04:33,telef.MKB Stank/Hinder. Lucht (INCI-01) (Inzet/afst. MO Func: ovdbvz),Broekkade,Schiedam
21-12-19,15:04:29,P 1,Ass. AMBU (INCI-02) (Inzet Brw: aed) Sporthal de Acker Groeneweg,Bergschenhoek,170XXX-XXXXXX
21-12-19,14:56:12,P 2,BDH-01,Liftopsluiting Alexander Fleminglaan,DELFT,155530
21-12-19,14:55:53,A1,Noordzee,NDWKZH
21-12-19,14:40:17,U bent nu actief in de functie Piket_Coordinator,Drone,Team.
21-12-19,14:40:17,U bent niet langer actief in de functie Piket_Coordinator,Drone,Team.
21-12-19,14:32:09,P 1,Handmelder OMS (INCI-01) Martha Flora Rotterdam Schubertlaan,Rotterdam,171031
21-12-19,14:09:52,P 2,BDH-03,Buitenbrand Diepenbrockstraat Van der Horststraat,DELFT,155530
21-12-19,14:09:16,P 1,BDH-02,Autom. brand OMS World Forum Convention Center Churchillplein,SGRAVH,157130
21-12-19,14:07:09,P 1,BDH-01,Ass. ambu (first responder) Binnenweg,WASSNR,155026
21-12-19,14:01:05,P 1,Ass. AMBU (INCI-02) Curacaolaan,Vlaardingen,179232
21-12-19,13:45:03,P 1,Autom. brand OMS (INCI-02) S.P. De Lichtboei Kreekpad,Rotterdam,173731
21-12-19,13:41:23,P 2,BDH-04,Liftopsluiting Leyweg,SGRAVH,157730
21-12-19,13:38:42,P 2,BDH-05,Wateroverlast Huis te Landelaan,RIJSZH,155630
21-12-19,13:27:29,P 2,Containerbrand (INCI-03) Hooglandstraat,Rotterdam,170931
21-12-19,12:58:48,P 2,BDH-04,Ass. ambu (afhijsen patient) Woning Julianastraat RIJSZH,157650,155630
21-12-19,12:37:40,A1 De Zandmotor Strandopgang Schelppad MONSTR : (pat.,vervoer,,lifeguards)
21-12-19,12:36:07,P 2,BDH-02,Ass. ambu (afhijsen patient) Baronielaan WASSNR,164252,155030
21-12-19,12:34:24,P 1,BDH-01,Autom. brand OMS New Babylon,Plint en Garage Bezuidenhoutseweg,SGRAVH,157230
21-12-19,12:20:18,P 2,Stank/Hinder. Lucht (INCI-04) Valeriusstraat,Vlaardingen,179232
21-12-19,11:34:35,P 1,Handmelder OMS (INCI-03) Gemeente Rotterdam Stadsbeheer Kralingse Zoom,Rotterdam,170931
21-12-19,10:58:25,P 2,Dienst aan derden (INCI-03) Van Deventerstraat,Schiedam,170431
21-12-19,10:55:35,P 1,Ongeval (INCI-02) (Aantr.: gaslucht) Rodaristraat Rotterdam,179193,171031
21-12-19,10:49:22,vervallen Autom. brand OMS (Etage: 7) Nijeveld (Prins Alexanderpolder) G.B.,Shawplaats,Rotterdam
21-12-19,10:48:22,P 1,Autom. brand OMS (INCI-02) (Etage: 7) Nijeveld (Prins Alexanderpolder) G.B. Shawplaats,Rotterdam,171031
21-12-19,10:31:10,P 1,BDH-06,Alarm rookmelder Hildebrandstraat,SGRAVH,157630
21-12-19,10:00:39,P 2,BDH-05,Liftopsluiting Gerrit van der Veenlaan,SGRAVH,157730
21-12-19,09:55:05,P 2,BDH-04,Liftopsluiting Damplein,LEIDDM,155130
21-12-19,09:53:05,P 1,BDH-03,Autom. brand OMS VVE Promenenade 1 Hasebroekstraat,SGRAVH,157630
21-12-19,09:53:01,P 2,Buitenbrand (INCI-04) Boulevard Rozenburg,ZH,171731
21-12-19,09:38:29,P 1,Handmelder OMS (INCI-02) Supermarkt Jumbo Hesseplaats,Rotterdam,171031
21-12-19,09:34:18,P 3,Afstemverzoek (INCI-02) (Inzet Brw Log & OnS: td / techn. dienst) 17 11 Capelle aan den IJsel Slotlaan Capelle aan den,IJssel,179291
21-12-19,09:15:26,P 1,Ongeval (INCI-03) (Lekkage Gev stof: Gaslek) Schietbaanstraat Schiedam,179191,170431
21-12-19,09:04:59,P 3,Afstemverzoek (INCI-02) 17 05 Rotterdam Frobenstr. Frobenstraat,Rotterdam,179202
21-12-19,08:51:05,P 2,Dienst aan derden (INCI-06) Supermarkt Jumbo Hadewychplaats,Spijkenisse,173131
21-12-19,08:30:35,Proefalarm Ochtend Brandweer Veiligheidsregio,Rotterdam,Rijnmond.
21-12-19,08:26:11,U bent nu actief in de functie Piket_GHOR_Operationeel medewerker,actiecentrum,.
21-12-19,08:03:28,P 1,Ass. AMBU (INCI-05) (Inzet Brw: aed) Nietzschestraat Rotterdam,173361,173431
21-12-19,07:52:20,P2 Ophalen 17-9262 Maripharm Nieuw-Mathenesserstraat,Rotterdam,179181
21-12-19,07:51:42,P 2,Containerbrand (INCI-02) Willem van Hillegaersbergstraat,Rotterdam,170331
21-12-19,06:57:10,P 2,Buitenbrand (INCI-02) Cape Helius Nieuwe Zeedijk,Hellevoetsluis,172531
21-12-19,06:48:57,P 2,Buitenbrand (INCI-02) Cape Helius Nieuwe Zeedijk,Hellevoetsluis,172561
21-12-19,06:20:35,P 2,BDH-01,Ongeval letsel (afhijsen patient) Jan Olierookstraat POELDK,157750,157730
21-12-19,05:03:56,P 2,BDH-02,Dienstverlening Jozef Israelslaan,RIJSZH,155630
21-12-19,04:23:05,Prio 2 graag 179184 en DP naar incident,voor,opruimen
21-12-19,04:17:44,P 1,Buitenbrand (INCI-02) Prinses Margrietlaan Willem van Hillegaersbergstraat,Rotterdam,170331
21-12-19,03:51:16,P 2,BDH-02,Buitenbrand Architect Jan Wilsstraat,SGRAVH,157730
21-12-19,03:27:32,P 2,AFLOS!! Gebouwbrand industrie (INCI-01) (GRIP: 1) (Ops Br: zeer groot) (chemisch) Maripharm Nieuw-Mathenesserstraat,Rotterdam,172551
21-12-19,03:24:12,P 1,Brand wegvervoer (INCI-06) Straatweg,Rotterdam,170331
21-12-19,03:23:25,P 1,Voertuig te water (INCI-05) De Draaimolen Stellingmolen,Barendrecht,179199
21-12-19,03:21:22,P 1,Voertuig te water (INCI-05) De Draaimolen Stellingmolen Barendrecht 173631 171111 173451,179194,173731
21-12-19,03:03:20,P2 Aflos HW !! Gebouwbrand industrie (INCI-01) (GRIP: 1) (Ops Br: zeer groot) (chemisch) Maripharm Nieuw-Mathenesserstraat,Rotterdam,170251
21-12-19,02:57:39,P2 Aflos!! Gebouwbrand industrie (INCI-01) (GRIP: 1) (Ops Br: zeer groot) (chemisch) Maripharm Nieuw-Mathenesserstraat,Rotterdam,173632
21-12-19,02:56:12,graag opkomen voor,HRU,inzet!!!!
21-12-19,02:50:58,P 1,Brand wegvervoer (INCI-03) (personenauto) Wijnruitstraat Hoogvliet,Rotterdam,172131
21-12-19,02:49:29,P 2,Wateroverlast (INCI-02) Nieuwe Binnenweg,Rotterdam,170532
21-12-19,02:42:35,P 2,Buitenbrand (INCI-09) (Inzet Brw Log & OnS: so / slangen opruim) Rotterdamsedijk Van Deventerstraat,Schiedam,179283
21-12-19,02:33:18,P 2,BDH-02,Buitenbrand container Van Vlotenstraat Jan van Beersstraat,SGRAVH,157630
21-12-19,02:19:09,P 1,Ass. AMBU (INCI-02) (Inzet Brw: aed) Rivium 1e straat Capelle aan den,IJssel,171131
21-12-19,01:44:39,P 2,Buitenbrand (INCI-03) Sara Burgerhart erf Capelle aan den,IJssel,171031
21-12-19,01:25:09,P 1,Ass. AMBU (INCI-02) (Inzet Brw: aed) Bellefleurhof,Rotterdam,173331
21-12-19,01:10:35,P 1,BDH-03,Buitenbrand afval/rommel Zeezwaluwstraat Nieboerweg,SGRAVH,159591
21-12-19,01:06:18,P 2,BDH-02,Buitenbrand Pluvierstraat,SGRAVH,157130
21-12-19,00:13:13,P 1,Gebouwbrand industrie (INCI-01) (GRIP: 1) (Ops Br: zeer groot) (chemisch) Maripharm Nieuw-Mathenesserstraat,Rotterdam,172161
20-12-19,23:59:28,P 1,Gebouwbrand industrie (INCI-01) (GRIP: 1) (Ops Br: zeer groot) (Inzet Brw CO&VB: Drone Gezagvoerder,Droneteam) (chemisch) Maripharm,Nieuw-Mathenesserstraat,Rotterdam
20-12-19,23:57:07,P 2,Herbez./Kazern. Kazerne Vlaardingen,Vlaardingen,170232
20-12-19,23:51:46,P 2,Buitensluiting (INCI-03) Koningswaard,Rotterdam,173731
20-12-19,23:48:14,P 2,BDH-03,Buitenbrand Bragastraat Linnaeusstraat,SGRAVH,157630
20-12-19,23:23:16,P 2,Dienstverlening (Inzet Brw Log & OnS: vz / verzorging) Kazerne Krimpen aan den IJssel Krimpen aan den IJssel,179286,179281
20-12-19,23:22:54,P 2,Herbez./Kazern. (INCI-12) Kazerne Vlaardingen,Vlaardingen,SK45
20-12-19,23:21:27,P 1,BDH-02,Voertuigbrand AH Vrij Abtswoude,DELFT,155530
20-12-19,23:18:22,P 1,Ongeval (INCI-14) (Instorting/bedelving) (Beknelling) Rotterdam Container Terminal Missouriweg 17 Maasvlakte Rotterdam 179195,171431,179982
20-12-19,23:16:11,P 1,Ongeval (INCI-14) (Instorting/bedelving) (Beknelling) Rotterdam Container Terminal Missouriweg Maasvlakte Rotterdam 179195,171431,179982
20-12-19,23:10:03,GAARNE,CONTACT,MKB
20-12-19,23:09:41,P 2,Dienstverlening (INCI-13) (Inzet Brw IBGS: meting) Van Deventerstraat,Rotterdam,171121
20-12-19,23:06:14,P 1,BDH-03,Ass. ambu (tilassistentie) Het Tolland,WATERI,156830
20-12-19,23:05:42,P 2,Herbez./Kazern. (INCI-12) Kazerne Vlaardingen,Vlaardingen,SK27
20-12-19,23:05:10,P 2,Herbez./Kazern. (INCI-02) Kazerne Schiedam,Schiedam,SK31
20-12-19,23:02:48,P 2,BDH-02,Buitenbrand container (afvalcontainer) Almeloplein,SGRAVH,157730
20-12-19,22:56:39,P 2,Herbez./Kazern. (INCI-05) Kazerne Baan,Rotterdam,sk33
20-12-19,22:54:57,P 2,BDH-06,Buitenbrand berm/ruigte Middelweg,SGRAVH,155430
20-12-19,22:53:07,P 1,Bijstand (INCI-11) (Ops GBO Brand: 1 pel. brand bs) Van Berckenrodestraat Rotterdam 179193 170XXX-XXXXXX,173431,170931
20-12-19,22:48:52,P 1,Gebouwbrand industrie (INCI-01) (GRIP: 1) (Ops Br: zeer groot) (Inzet/afst. Brw Func: HOVD) (chemisch) Maripharm Nieuw-Mathenesserstraat,Rotterdam,179092
20-12-19,22:46:03,P 2,Liftopsluiting (INCI-08) (Etage: 1) Molenvliet,Rotterdam,173361
20-12-19,22:43:59,GAARNE INMELDEN MKB IVM,GBO,INZET
,20-12-19,22:40:38,vervallen,vervallen!!!!
