14-01-20,16:32:28,P 2,Onderzoek (INCI-03) (Inzet/afst. Brw Func: AGS,OvDB) GDF Sues Energie Nederland Missouriweg Maasvlakte Rotterdam,179195,179021
14-01-20,15:32:22,P 1,Brand spoorvervoer (INCI-01) (Metro) Metro Coolhaven Perron Coolhaven,Rotterdam,170331
14-01-20,15:30:58,P 1,Brand spoorvervoer (INCI-01) (Metro) Metro Coolhaven Perron,Coolhaven,Rotterdam
14-01-20,15:28:54,P 1,Gebouwbrand (INCI-02) (kelder/souterrain) Bachplein Schiedam,170XXX-XXXXXX,179233
14-01-20,15:28:11,P 1,Brand spoorvervoer (INCI-01) Metro Coolhaven Perron Coolhaven Rotterdam 173451 179192 179021,179081,170XXX-XXXXXX
14-01-20,15:05:50,U bent nu actief in de functie,Piket_GB_Technische,dienst.
14-01-20,15:05:50,U bent niet langer actief in de functie,Piket_GB_Technische,dienst.
14-01-20,14:56:31,P 1,BDH-01,Autom. brand OMS Verzorgingshuis Op de Laan Laan van Meerdervoort,SGRAVH,157230
14-01-20,14:50:20,TS Laak mag retour naar Laak,onder dankzegging,TS,Delft
14-01-20,14:28:20,P 2,Containerbrand (INCI-02) J.B. Bakemakade,Rotterdam,170631
14-01-20,14:07:19,P 1,Autom. brand OMS (INCI-01) Schieland Toren Bulgersteyn,Rotterdam,170631
14-01-20,14:07:19,P 2,BDH-20,Stank/Hinder. lucht (vreemde lucht) Beeklaan,SGRAVH,159660
14-01-20,13:48:09,VERVALLEN!!! Autom. brand OMS Stichting Robbenoord,Schulpweg,Rotterdam
14-01-20,13:47:25,P 1,Autom. brand OMS (INCI-02) Stichting Robbenoord Schulpweg,Rotterdam,173431
14-01-20,13:42:50,OEFENINING!!!! Drukknopmelding OMS (INCI-01) APM Terminals (HN 8203) Coloradoweg Maasvlakte,Rotterdam,171431
14-01-20,13:22:09,P 1,BDH-02,Ass. ambu (first responder) Politiebureau 43 (Wassenaar) Hofcampweg,WASSNR,155026
14-01-20,13:20:03,P 1,Autom. brand OMS (INCI-03) Stadzicht Geriatrisch (Overschie) Overschiese Kleiweg,Rotterdam,170331
14-01-20,12:57:48,P 1,Ass. AMBU (INCI-01) (Inzet Brw: aed) Gangesstraat,Spijkenisse,173131
14-01-20,12:46:57,P 2,BDH-01,Liftopsluiting Escamplaan,SGRAVH,157730
14-01-20,12:43:50,P 1,Ongeval binnen (INCI-02) (Aantr.: gaslucht) Jacob Catsstraat Ridderkerk,179194,173831
14-01-20,11:32:35,vervallen brand OMS De Tweemaster Zwn,Vondelpark,Maassluis
14-01-20,11:31:13,P 1,Ongeval (INCI-03) (Lekkage Gev stof: Gaslek) ABN Amro Bank de Korf De Korf Krimpen aan den,IJssel,163630
14-01-20,11:31:01,P 1,Autom. brand OMS (INCI-02) De Tweemaster Zwn Vondelpark,Maassluis,170231
14-01-20,11:26:18,P 1,Ongeval (INCI-03) (Lekkage Gev stof: Gaslek) ABN Amro Bank de Korf De Korf Krimpen aan den IJssel,179193,171231
14-01-20,11:20:55,P 1,Autom. brand OMS (INCI-02) Euro Hotel Baan,Rotterdam,170631
14-01-20,11:18:22,P 1,BDH-02,Autom. brand OMS Groepswoning Ipse de Bruggen Zwaardvegersgaarde,SGRAVH,157630
14-01-20,11:06:05,P 1,Gebouwbrand woning (INCI-01) (schoorsteen) Kreupeleweg Klaaswaal 185451,185631,185531
14-01-20,11:01:44,P 1,BDH-01,Autom. brand OMS WZH Sammersbrug Lichtenbergweg,SGRAVH,157730
14-01-20,10:50:37,P 2,BDH-04,Ass. ambu (tilassistentie) Abraham Bloemaertstraat,SGRAVH,157630
14-01-20,10:30:04,P 1,Autom. brand OMS (INCI-01) Staete Hillegersberg Van Beethovenlaan,Rotterdam,171031
14-01-20,10:13:26,U bent niet langer actief in de functie Piket,CC,Voorne.
14-01-20,10:13:26,U bent nu actief in de functie Piket,CC,Voorne.
14-01-20,10:12:03,GOEDEMORGEN CONTACT,MKB,SVP
14-01-20,10:11:16,P 1,BDH-01,Voertuigbrand Siemenspad,ZOETMR,155330
14-01-20,10:08:31,GOEDEMORGEN BEVELVOERDER CONTACT,MKB,SVP
14-01-20,10:02:45,U bent nu actief in de functie,Piket_GMK_Algemeen,ondersteuner.
14-01-20,10:02:45,U bent niet langer actief in de functie,Piket_GMK_Algemeen,ondersteuner.
14-01-20,09:56:16,P 1,CO-melder (INCI-02) Oostzeedijk Beneden,Rotterdam,170931
14-01-20,09:07:24,U bent nu actief in de,functie,Piket_VRR_PC-LOG.
14-01-20,09:07:24,U bent niet langer actief in de,functie,Piket_VRR_PC-LOG.
14-01-20,08:59:35,telef.MKB Dienst aan derden (INCI-02) Hofplein,Rotterdam,170631
14-01-20,08:52:02,P 1,Autom. brand OMS (INCI-01) Sophiatunnel Schachtgebouw West Krommeweg,Hendrik-Ido-Ambacht,186432
14-01-20,08:46:55,P 5,Testmelding,SGRAVH,159591
14-01-20,08:46:05,U bent nu actief in de functie Piket_VRR_Communicatie,VRR,Woordvoerders.
14-01-20,08:46:03,U bent niet langer actief in de functie Piket_VRR_Communicatie,VRR,Woordvoerders.
14-01-20,08:35:45,U bent nu actief in de functie Piket_BRW_Tactisch Officier,Alarmcentrale,.
14-01-20,08:35:45,U bent niet langer actief in de functie Piket_BRW_Tactisch Officier,Alarmcentrale,.
14-01-20,08:33:20,GOEDEMORGEN CONTACT,MKB,SVP
14-01-20,08:32:04,U bent nu actief in de functie Piket,TCO,Coordinator.
14-01-20,08:32:04,U bent niet langer actief in de functie Piket,TCO,Coordinator.
14-01-20,08:31:05,Proefalarm Ochtend Brandweer Veiligheidsregio,Rotterdam,Rijnmond.
14-01-20,08:23:39,P 2,Brandgerucht (INCI-01) Generaal Snijdersstraat,Nieuwe-Tonge,174631
14-01-20,07:21:25,P 1,BDH-04,Autom. brand OMS Shortstay Lekstraat,SGRAVH,157230
14-01-20,07:11:44,P 2,BDH-03,Wateroverlast Beresteinlaan,SGRAVH,157730
14-01-20,07:01:37,P 1,BDH-01,Autom. brand OMS Woning Ipse de Bruggen Cadmiumgeel,ZOETMR,155330
14-01-20,06:34:12,P 1,BDH-01,Autom. brand OMS R.I.V. Haagzicht Ruijsdaelstraat,SGRAVH,157830
14-01-20,06:09:54,P 2,Stormschade (INCI-01) Rottebandreef,Bergschenhoek,170761
14-01-20,05:01:14,P 1,Brandgerucht (INCI-03) Crooswijkseweg,Rotterdam,170931
14-01-20,04:36:14,P 1,BDH-01,OMS Geverifieerd (brandmelding OMS) 1e Kamer der Staten Generaal Binnenhof,SGRAVH,157230
14-01-20,04:01:56,P 1,Brand wegvervoer (INCI-02) Maldenburg,Rotterdam,173361
14-01-20,03:59:25,P 1,BDH-04,Ass. ambu (afhijsen patient) Geysterenweg SGRAVH,157650,157630
14-01-20,03:52:48,P 1,BDH-02,Voertuig te water Doelenplein DELFT,155510,155530
14-01-20,03:38:14,P 1,BDH-01,Autom. brand OMS Wooncentrum Delfgauw Laan der Zeven Linden,DELFGW,155430
14-01-20,03:35:16,P 2,Buitenbrand (INCI-02) Bloemendaal,Dirksland,174331
14-01-20,02:48:39,P 1,Autom. brand OMS (INCI-01) Biopetrol Rotterdam Welplaatweg Botlek,Rotterdam,172031
14-01-20,02:05:48,P 1,BDH-03,Gebouwbrand kantoor De Globe Waldorpstraat SGRAVH 157650 159591,157630,157830
14-01-20,01:51:03,P 1,BDH-02,Autom. brand OMS De Globe Waldorpstraat,SGRAVH,157630
14-01-20,01:46:01,P 1,BDH-01,Ass. ambu (afhijsen patient) Liesveld WATERI,157750,156830
14-01-20,01:08:22,P 2,Stormschade (INCI-03) Havendijk,Schiedam,170431
14-01-20,00:54:18,P 2,Buitenbrand (INCI-02) Zweedsestraat Poolsestraat,Rotterdam,170431
13-01-20,23:51:22,P 1,Gebouwbrand woning (INCI-01) (Etage: 12) Koningin Wilhelminalaan Gorinchem,188151,188132
13-01-20,22:36:41,P 1,BDH-02,Autom. brand OMS Stichting Anton Constandse Carry van Bruggenhof,SGRAVH,157630
13-01-20,22:29:52,P 2,BDH-01,Wateroverlast Bruijnings Ingenhoeslaan,VOORB,155130
13-01-20,22:23:10,P 1,Gebouwbrand woning (INCI-02) Oranjelaan Westzijde,Puttershoek,186031
,,13-01-20,22:10:36,P1
13-01-20,22:04:44,P 1,BDH-02,Stank/Hinder. lucht (gaslucht) Almeloplein,SGRAVH,157730
13-01-20,21:45:33,P 1,Ass. AMBU (INCI-01) (Inzet Brw: aed) Muizenburg,Barendrecht,179194
13-01-20,21:44:29,P 1,Ass. AMBU (INCI-01) (Inzet Brw: aed) Muizenburg Barendrecht,173361,173431
13-01-20,21:42:10,P 2,BDH-03,Buitenbrand Toscaninistraat,SGRAVH,157730
13-01-20,20:57:03,P 2,BDH-04,Buitenbrand Harstenhoekplein,SGRAVH,159630
13-01-20,20:46:20,P 2,BDH-03,Buitenbrand Prins Albertlaan,VOORB,155130
13-01-20,20:23:27,P 2,Ass. AMBU (INCI-02) (Inzet Brw: RV Afhijsen) Keilestraat,Rotterdam,170XXX-XXXXXX
13-01-20,20:21:44,P 1,BDH-01,Autom. brand OMS Brinkman Distributiecentrum Woutersweg,SGRAVZ,156530
13-01-20,20:09:54,U bent niet langer actief in de,functie,Piket_HO_HMR.
13-01-20,20:09:54,U bent nu actief in de,functie,Piket_HO_HMR.
13-01-20,20:01:50,P 2,Ass. AMBU (INCI-01) (Inzet Brw: RV Afhijsen) Adriaan Roland Holststraat Rotterdam,171151,171031
13-01-20,19:54:59,P 3,Afstemverzoek (Inzet Brw Log & OnS: td / techn. dienst) World Port center Wilhelminakade,Rotterdam,179291
13-01-20,19:44:20,P 1,Autom. brand OMS (INCI-04) Erasmus Univ. Onderterrein. Burgemeester Oudlaan,Rotterdam,170931
13-01-20,19:16:22,P 1,BDH-04,Stank/Hinder. lucht (gaslucht) Almeloplein,SGRAVH,157730
13-01-20,19:07:27,P 2,BDH-02,Liftopsluiting Dedemsvaartweg,SGRAVH,157730
13-01-20,18:55:24,P 1,BDH-03,Alarm rookmelder Hildebrandstraat,SGRAVH,157630
13-01-20,18:53:37,P 2,BDH-01,Wateroverlast Beethovenlaan,DELFT,155530
13-01-20,18:31:16,P 2,Brandgerucht (INCI-01) Dorpsweg,Rotterdam,173561
13-01-20,18:20:05,P 2,Liftopsluiting (INCI-03) Weena,Rotterdam,170631
13-01-20,18:17:16,P 1,Ongeval (INCI-02) (Aantr.: gaslucht) Alsemstraat Hoogvliet Rotterdam,179195,171633
13-01-20,18:15:54,Proefalarm Avond Brandweer Veiligheidsregio,Rotterdam,Rijnmond.
13-01-20,18:08:37,P 1,BDH-02,Autom. brand OMS VVE Promenenade 2 Hasebroekstraat,SGRAVH,157630
13-01-20,18:08:37,Scenario Proefalarm NHT plus is,geactiveerd,.
13-01-20,18:02:14,P 3,Afstemverzoek (INCI-02) World Port center Wilhelminakade,Rotterdam,179291
13-01-20,18:00:57,P 2,Brandgerucht (INCI-01) Glashaven Jufferkade,Rotterdam,170631
13-01-20,17:49:37,P 2,BDH-01,Buitenbrand Baambruggestraat,SGRAVH,157730
13-01-20,17:31:13,U bent niet langer actief in de functie Piket_VRR_Communicatie,VRR,Woordvoerders.
13-01-20,17:31:13,U bent nu actief in de functie Piket_VRR_Communicatie,VRR,Woordvoerders.
13-01-20,17:28:13,U bent nu actief in de functie Piket_VRR_Hoofd,sectie,communicatie.
13-01-20,17:28:13,U bent niet langer actief in de functie Piket_VRR_Hoofd,sectie,communicatie.
13-01-20,17:27:37,P 2,Stank/Hinder. Lucht (INCI-05) Steenbreekvaren,Bergschenhoek,170761
,,13-01-20,17:09:59,P2
13-01-20,16:47:50,P 1,BDH-02,Brandgerucht Thomas Morelaan,ZOETMR,155330
13-01-20,16:41:12,P 1,Handmelder OMS (INCI-03) Boumanggz IBW Romanohof Romanohof,Rotterdam,171031
13-01-20,16:37:18,P 1,BDH-01,Stank/Hinder. lucht (gaslucht) Zilverreigerdreef,PIJNAK,155430
13-01-20,16:21:53,P 2,Buitenbrand (INCI-02) Wipperspark,Maassluis,170231
13-01-20,16:04:16,P 2,Brandgerucht (INCI-01) Langeweg,Sommelsdijk,174531
13-01-20,15:47:57,P 2,BDH-05,Stormschade (los dak/geveldeel) Molenweg,MONSTR,156730
13-01-20,15:45:31,P 1,BDH-03,Autom. brand OMS Willibrordushuis Oude Molstraat,SGRAVH,157230
13-01-20,15:34:44,P 2,Wateroverlast (INCI-01) Boompjes,Rotterdam,170631
13-01-20,15:33:40,P 2,BDH-04,Ass. ambu (afhijsen patient) Laakkade SGRAVH,157650,157630
13-01-20,15:33:09,P 1,BDH-03,OMS Geverifieerd (brandmelding OMS) Parkhotel Den Haag Molenstraat,SGRAVH,157230
13-01-20,15:25:27,P 2,BDH-01,Dier op hoogte Copernicusstraat,SGRAVH,157830
13-01-20,15:00:33,Het scenario SGBO Proefalarm is geactiveerd! U wordt benaderd door SMART Respond of u kunt inbellen,via,0XXXXXXXXX.
13-01-20,14:59:53,Het scenario SGBO Proefalarm is geactiveerd! U wordt benaderd door SMART Respond of u kunt inbellen,via,0XXXXXXXXX.
13-01-20,14:28:35,P 2,Nacontrole (INCI-03) Goteborg,Schiedam,170431
13-01-20,14:18:58,P 1,Ass. AMBU (INCI-02) (Inzet Brw: RV Afhijsen) Milliadeplein Berkel en Rodenrijs,170XXX-XXXXXX,170731
13-01-20,14:08:40,P 1,Ass. AMBU (INCI-02) (Inzet Brw: aed) Huniadijk,Rotterdam,173731
13-01-20,14:08:14,P 1,BDH-04,Autom. brand OMS New Babylon,Plint en Garage Bezuidenhoutseweg,SGRAVH,157230
13-01-20,14:04:09,P 1,Brandgerucht (INCI-01) Parket Tree Edisonstraat,Numansdorp,185531
13-01-20,13:47:31,P 2,BDH-04,Buitenbrand Van Mierisstraat,SGRAVH,157830
13-01-20,13:31:46,P 2,BDH-01,Stormschade (boom) Donker Curtiusstraat Mgr. Nolenslaan,SGRAVH,157730
13-01-20,13:22:59,P 1,Ass. AMBU (INCI-02) (Inzet Brw: aed) Akker,Brielle,172631
13-01-20,13:22:35,P 1,Gebouwbrand woning (INCI-01) Wilgenlei Rotterdam,170XXX-XXXXXX,170532
13-01-20,13:08:03,P 1,BDH-04,Autom. brand OMS Nolenshaghe Mgr. Nolenslaan,SGRAVH,157730
13-01-20,13:06:01,P 1,BDH-20,Ass. ambu Escamplaan,SGRAVH,159661
13-01-20,13:01:49,P 5,BDH-02,Ongeval letsel Total Nederland N.V. Nieuwe Havenstraat VOORB 155150,159670,155130
13-01-20,13:01:37,P 2,Dienst aan derden (INCI-01) Motorstraat,Rotterdam,173431
13-01-20,12:58:45,P 1,BDH-01,Autom. brand OMS New Babylon,Plint en Garage Bezuidenhoutseweg,SGRAVH,157230
13-01-20,12:58:31,P 2,Containerbrand (INCI-04) Mgr. W.M. Bekkerslaan,Maassluis,170231
13-01-20,12:37:28,U bent nu actief in de functie Piket,TCO,Coordinator.
13-01-20,12:37:28,U bent niet langer actief in de functie Piket,TCO,Coordinator.
13-01-20,12:29:17,P 1,BDH-03,Stank/Hinder. lucht (koolmonoxide/CO) Esdoornstraat,SGRAVH,157150
13-01-20,12:24:57,P 1,BDH-03,Stank/Hinder. lucht (koolmonoxide/CO) Esdoornstraat SGRAVH,159591,159633
13-01-20,12:09:35,P 1,BDH-20,Ongeval wegvervoer letsel Cirkel Flat Lozerlaan,SGRAVH,159661
13-01-20,11:58:54,P 2,Ass. AMBU (INCI-02) (Inzet Brw: til assistentie) Mandenmakerstraat Hoogvliet,Rotterdam,171631
13-01-20,11:51:01,P 2,Stank/Hinder. Lucht (INCI-01) (Aantr.: vreemde lucht) Jan van Zutphenstraat,Spijkenisse,173131
13-01-20,11:26:11,P 1,BDH-02,Autom. brand OMS De Thuishaven Neptunusstraat,SGRAVH,157230
13-01-20,11:24:12,P 1,BDH-01,Buitenbrand afval/rommel Houtrustweg,SGRAVH,159633
13-01-20,11:08:48,P 1,BDH-05,Ongeval letsel (afhijsen patient) Neherkade SGRAVH,157650,157630
13-01-20,10:58:37,P 1,BDH-03,Ass. ambu (first responder) Frederik Hendriklaan,SGRAVH,157109
13-01-20,10:41:40,P 2,BDH-04,Ongeval letsel (afhijsen patient) Meppelweg SGRAVH,157750,157730
13-01-20,10:41:16,P 2,BDH-20,Stank/Hinder. lucht (vreemde lucht) Pluvierstraat,SGRAVH,159661
13-01-20,10:40:07,U bent nu actief in de functie Piket_GHOR_Operationeel Directeur,GHOR,.
13-01-20,10:39:47,U bent nu actief in de,functie,Piket_VRR_Directiewacht.
13-01-20,10:39:47,U bent niet langer actief in de,functie,Piket_VRR_Directiewacht.
13-01-20,10:39:12,P 1,BDH-03,Autom. brand OMS Zo Van Nijenrodestraat,SGRAVH,159633
13-01-20,10:36:37,P 1,Ass. AMBU (INCI-01) (Inzet Brw: RV Afhijsen) Krekelveen Spijkenisse,173151,173131
13-01-20,10:15:11,P 2,BDH-02,Geplande actie (helilanding) Helispot HMC Westeinde Warmoezierstraat,SGRAVH,157230
13-01-20,09:54:03,P 2,Dier op hoogte (INCI-01) Samuel Esmeijerstraat,Vlaardingen,179233
13-01-20,09:47:03,P 2,Dier op hoogte (INCI-02) (huisdier) Pioentuin,Bergschenhoek,170551
13-01-20,09:44:56,P 1,BDH-02,OMS Geverifieerd (brandmelding OMS) Societeit Alcuin Oude Delft,DELFT,155530
13-01-20,09:39:31,P 1,BDH-01,Gebouwbrand cel Penitentiaire Inr. Haaglanden Pompstationsweg,SGRAVH,157150
13-01-20,09:36:01,P 2,Dier op hoogte (INCI-02) (huisdier) Pioentuin,Bergschenhoek,170761
13-01-20,09:35:51,P 1,BDH-01,Autom. brand OMS Penitentiaire Inr. Haaglanden Pompstationsweg SGRAVH 159670 159591,159633,157230
13-01-20,09:08:33,P 1,BDH-02,Autom. brand OMS Stadhuis Zoetermeer(BRW-ing) Frankrijklaan,ZOETMR,155230
13-01-20,09:06:12,P 1,BDH-20,Ongeval wegvervoer letsel A4 Li 49,5,RIJSZH,159661
13-01-20,08:46:18,P 1,Gebouwbrand woning (INCI-03) Oosterse tuin Rotterdam 173751,173731,173431
13-01-20,08:38:43,P 1,Ass. AMBU (INCI-03) (Inzet Brw: aed) Burgemeester Van Haarenlaan,Schiedam,170431
13-01-20,08:30:46,Proefalarm Ochtend Brandweer Veiligheidsregio,Rotterdam,Rijnmond.
13-01-20,08:30:24,U bent nu actief in de functie Piket_VRR_Hoofd,sectie,communicatie.
13-01-20,08:30:24,U bent niet langer actief in de functie Piket_VRR_Hoofd,sectie,communicatie.
13-01-20,08:24:24,U bent nu actief in de functie Piket_VRR_Ondersteuner sectie,communicatie,.
13-01-20,08:24:24,U bent niet langer actief in de functie Piket_VRR_Ondersteuner sectie,communicatie,.
13-01-20,08:20:47,P 3,,Afstemverzoek,mkb
,13-01-20,08:16:59,Goedemorgen,TEST
,13-01-20,08:16:38,Goedemorgen,TEST
13-01-20,08:04:45,U bent nu actief in de functie Piket_VRR_Communicatie,VRR,Woordvoerders.
13-01-20,08:04:45,U bent niet langer actief in de functie Piket_VRR_Communicatie,VRR,Woordvoerders.
13-01-20,08:00:43,U bent niet langer actief in de functie Piket_GHOR_Operationeel medewerker,actiecentrum,.
13-01-20,07:52:44,U bent nu actief in de functie Piket_GHOR_Officier,van,dienstWEST.
13-01-20,07:48:24,U bent nu actief in de functie Piket,CC,IJsselland.
13-01-20,07:48:24,U bent niet langer actief in de functie Piket,CC,IJsselland.
13-01-20,07:39:54,P 1,BDH-02,Autom. brand OMS World Fashion Appartments Gevers Deynootweg,SGRAVH,159633
13-01-20,07:15:46,P 1,Brand wegvervoer (INCI-02) (personenauto) A29 Li 13,0 Barendrecht 189491 189492,185731,173631
13-01-20,06:55:09,P 1,Autom. brand OMS (INCI-01) LOGISTIEKCENTRUM Hulaco Klappolder,Bleiswijk,159630
13-01-20,06:52:14,P 1,Autom. brand OMS (INCI-01) LOGISTIEKCENTRUM Hulaco Klappolder,Bleiswijk,170831
13-01-20,03:55:20,P 2,Containerbrand (INCI-01) (Kleding) Portlandse Baan Onyxlaan,Rhoon,173431
13-01-20,03:34:29,P 2,Containerbrand (INCI-01) Portlandse Baan Onyxlaan,Rhoon,173361
13-01-20,03:22:14,P 1,BDH-01,Voertuigbrand Uitterlier,DELIER,156930
13-01-20,00:23:59,P 2,Wateroverlast (INCI-03) Polslandstraat,Rotterdam,173431
12-01-20,23:48:01,P 1,Brandgerucht (INCI-01) De Koningshoek Wc Koningshoek,Maassluis,170231
12-01-20,23:42:37,P 1,Ass. AMBU (INCI-02) (Inzet Brw: til assistentie) Dieze,Rotterdam,171031
12-01-20,23:36:16,P 1,BDH-03,Ongeval materieel (Lekkage: gas overig) Stille Putten DELFT,159591,155530
12-01-20,23:23:09,P 1,BDH-01,Autom. brand OMS Hotel Wassenaar N441 - Katwijkseweg,WASSNR,155030
12-01-20,23:14:05,P 1,Brand wegvervoer (INCI-01) (vrachtwagen) A20 Li 36,5 Rotterdam,171031,179237
12-01-20,22:32:11,P 2,BDH-01,Buitenbrand container Prins Hendrikplein Prins Hendrikstraat,SGRAVH,157230
12-01-20,22:25:35,P 5,Uitval nutsvoorzieningen Van Lennepweg ambassade,Polen,SGRAVH
12-01-20,22:08:16,P 1,Ongeval (INCI-01) (Aantr.: gaslucht) Coornhertstraat Rotterdam,179192,170431
12-01-20,21:44:27,P 1,Containerbrand (INCI-01) Valeriusstraat Dirk Schaferstraat,Vlaardingen,179233
12-01-20,21:09:31,P 1,BDH-02,Gebouwbrand woning Burgemeester Velthuijsenlaan LEIDDM 155150 159591,155130,157430
12-01-20,21:08:05,P 1,Ass. AMBU (INCI-03) (Inzet Brw: RV Afhijsen) Dordtselaan Rotterdam,173451,173431
12-01-20,21:05:48,P 1,BDH-01,Stank/Hinder. lucht (gaslucht) Suezkade,SGRAVH,157830
12-01-20,20:57:50,P 1,Brand wegvervoer (INCI-02) (personenauto) Hooge Zeedijk,Maassluis,170231
12-01-20,20:56:37,P 2,BDH-01,Buitenbrand afval/rommel Van Kinsbergenstraat,SGRAVH,157830
12-01-20,20:31:05,P 2,BDH-02,Buitenbrand berm/ruigte Hannie Schaftstraat,LEIDDM,155130
12-01-20,20:11:11,P 2,BDH-01,Buitenbrand container (afvalcontainer) Soetensstraat,SGRAVH,159633
12-01-20,20:06:25,P 2,Buitenbrand (INCI-02) Meerwedesingel,Barendrecht,173361
12-01-20,19:24:57,P 1,Ass. AMBU (INCI-02) (Inzet Brw: aed) Sophiakade,Rotterdam,170931
12-01-20,18:52:37,P 1,Autom. brand OMS (INCI-02) WZC De Schans Jan Kruijffstraat,Rotterdam,179234
12-01-20,18:43:16,P 2,Autom. brand OMS (INCI-01) Sfg St. Fransiscus Rotterdam Kleiweg,Rotterdam,170331
12-01-20,18:40:42,P 2,BDH-01,Buitenbrand afval/rommel Wolweversgaarde Beresteinlaan,SGRAVH,157730
12-01-20,18:35:44,P 1,BDH-05,Gebouwbrand Klein Hitland NWKKIJ,171151,163731
12-01-20,18:27:25,P 2,CO-melder (INCI-04) Koninginneweg,Ridderkerk,173831
12-01-20,18:07:18,P 1,Ass. AMBU (INCI-03) (Inzet Brw: RV Afhijsen) Olivier van Noortlaan,Vlaardingen,170XXX-XXXXXX
12-01-20,17:39:37,P 1,Gebouwbrand agrarisch (INCI-03) De Trotse Pauw Marrewijklaan,Spijkenisse,173131
,,12-01-20,17:39:25,Vervallen
12-01-20,17:38:48,P 1,Ass. AMBU (INCI-04) (Inzet Brw: aed) Sara Burgerhart erf Capelle aan den,IJssel,171031
12-01-20,17:38:24,P 1,Gebouwbrand agrarisch (INCI-03) De Trotse Pauw Marrewijklaan Spijkenisse 173151,173132,171631
12-01-20,17:30:26,P 1,BDH-01,Autom. brand OMS Woning Lauwers 3 Ipse Lauwers,NOOTDP,157430
12-01-20,17:09:44,P 1,BDH-02,Ass. ambu (afhijsen patient) Dr Wibautlaan RIJSZH,157650,155630
12-01-20,17:07:39,P 1,Ass. AMBU (INCI-03) Moskee Othman Boezemdwarsstraat,Rotterdam,170931
12-01-20,16:54:01,P 2,BDH-01,Buitenbrand berm/ruigte van Ruysdaellaan,LEIDDM,155130
12-01-20,16:41:37,P 1,Ass. AMBU (INCI-03) (Inzet Brw: aed) Sportpark Smitshoek (voetbal tennis) Smitshoekse Baan Barendrecht,173361,173431
12-01-20,16:26:50,P 1,BDH-02,Ass. politie Louis Davidsstraat,RIJSZH,155630
12-01-20,16:20:57,P 1,BDH-01,Autom. brand OMS Carlton Beach Hotel Gevers Deynootweg,SGRAVH,159633
12-01-20,15:58:22,P 2,Herbez./Kazern. (INCI-03) Kazerne Spijkenisse,Spijkenisse,SK31
12-01-20,15:57:58,P 2,Brandgerucht (INCI-01) (Inzet/afst. Brw Func: OvDB) Plutopad,Spijkenisse,179196
12-01-20,15:49:38,P 1,Brandgerucht (INCI-01) Plutopad,Spijkenisse,17INC
12-01-20,15:47:16,P 3,Ass. AMBU (:!vervallen!: ) (Inzet Brw: aed),Plevierstraat,Bleiswijk
12-01-20,15:46:14,P 1,Ass. AMBU (INCI-04) (Inzet Brw: aed),Plevierstraat,Bleiswijk
12-01-20,15:45:22,P 1,Ass. AMBU (INCI-04) (Inzet Brw: aed) Plevierstraat,Bleiswijk,170831
12-01-20,15:43:46,P 2,BDH-04,Liftopsluiting De Savornin Lohmanplein,SGRAVH,157730
12-01-20,15:40:24,P 2,Containerbrand (INCI-03) Supermarkt Jumbo Botersloot,Rotterdam,170931
12-01-20,15:36:56,P 1,Brandgerucht (INCI-02) Plutopad,Spijkenisse,173131
12-01-20,15:27:47,P 2,BDH-02,Persoon te water Strand Noord,SGRAVH,157150
12-01-20,15:27:16,P 2,BDH-03,Nacontrole brand Belgischeplein,SGRAVH,157830
12-01-20,15:26:26,P 1,BDH-02,Persoon te water Strand Noord SGRAVH 159591 8802 8810 157140,157109,157810
12-01-20,15:23:16,P 2,Liftopsluiting (INCI-01) Eikenlaan,Spijkenisse,173131
12-01-20,15:13:18,P 1,BDH-01,Autom. brand OMS Hotel Room 11 Veenkade,SGRAVH,157230
12-01-20,14:59:07,P 1,Ongeval (INCI-01) (Aantr.: gaslucht) Lijnbaan Rotterdam,179192,179234
12-01-20,14:33:44,P 1,BDH-01,Buitenbrand afval/rommel Azaleapark,ZOETMR,155230
12-01-20,14:06:39,P 1,BDH-03,Gebouwbrand woning Kepplerstraat SGRAVH 157850 159591,157830,157230
12-01-20,14:05:07,P 2,BDH-02,Buitenbrand Houtrustweg,SGRAVH,159633
12-01-20,13:55:37,A1 Strand NDWKZH,:,RMNWKKHV
12-01-20,13:47:31,P 1,BDH-02,Ongeval wegvervoer letsel Melis Stokelaan Moerweg SGRAVH,159591,157630
12-01-20,13:41:40,P 2,Dienst aan derden (INCI-01) Baarnhoeve,Vlaardingen,179233
12-01-20,13:30:20,P 2,BDH-01,Wateroverlast Stichting Horizon Monsterseweg,SGRAVH,157770
12-01-20,13:28:46,P 2,BDH-01,Wateroverlast Stichting Horizon Monsterseweg,SGRAVH,157730
12-01-20,12:55:27,P 1,BDH-01,Ass. ambu (afhijsen patient) Geest SGRAVH,157850,157830
12-01-20,12:34:46,P 2,Buitenbrand (INCI-02) H. de Lintweg,Spijkenisse,173131
12-01-20,12:26:52,P 2,BDH-01,Liftopsluiting Woning Guido Gezellestraat,VOORB,155130
12-01-20,12:01:06,P 1,Ass. AMBU (INCI-01) (Inzet Brw: RV Afhijsen) Frans Halsstraat Capelle aan den IJssel,171151,179237
12-01-20,11:43:09,P 1,Ass. AMBU (INCI-01) (Inzet Brw: aed) Erfdijk,Rotterdam,173731
12-01-20,11:42:27,P 2,BDH-01,CO-melder (koolmonoxide/CO) Keizerstraat,SGRAVH,159633
12-01-20,11:24:20,P 3,Afstemverzoek (Inzet Brw Log & OnS: vz-ah / arbeidshyg) World Port center Wilhelminakade,Rotterdam,179201
12-01-20,10:41:52,P 1,BDH-02,Ass. ambu (afhijsen patient) Oranjeplein SGRAVH,157850,157830
12-01-20,09:57:30,P 1,Ass. AMBU (INCI-03) (Inzet Brw: aed) Zaagmolenstraat,Rotterdam,170551
12-01-20,09:56:29,P 1,Autom. brand OMS (:!vervallen!: ) Le Duc Fine Food Meester,Snijderweg,Stellendam
12-01-20,09:55:11,P 1,Autom. brand OMS (INCI-04) (:!vervallen!: ) Le Duc Fine Food Meester Snijderweg,Stellendam,174131
12-01-20,09:54:37,P 1,Autom. brand OMS (INCI-04) Le Duc Fine Food Meester Snijderweg,Stellendam,174131
12-01-20,09:47:39,P 1,Ass. AMBU (INCI-03) (Inzet Brw: aed) Zaagmolenstraat,Rotterdam,179234
12-01-20,09:14:05,P 2,Herbez./Kazern. (INCI-02) Kazerne Spijkenisse,Spijkenisse,SK31
12-01-20,09:13:01,P 1,Voertuig te water (INCI-01) (Inzet Brw Alg EH: RV) Spuiweg,Piershil,185451
12-01-20,09:10:14,P 1,Voertuig te water (INCI-01) Spuiweg Piershil 173111,189491,185131
12-01-20,08:34:12,P 2,BDH-03,Buitenbrand afval/rommel Duivelandsestraat,SGRAVH,159633
12-01-20,08:33:31,P 1,BDH-02,Buitenbrand Nootdorpseweg,PIJNAK,155430
12-01-20,08:30:46,Proefalarm Ochtend Brandweer Veiligheidsregio,Rotterdam,Rijnmond.
,,12-01-20,07:17:12,vervallen
12-01-20,07:16:50,P 2,Buitenbrand (INCI-03) Adriaen van der Doeslaan,Rotterdam,171031
12-01-20,07:15:35,P 2,Buitenbrand (INCI-02) Adriaen van der Doeslaan,Rotterdam,170331
12-01-20,06:50:43,P 1,Ongeval (INCI-01) (Lekkage Gev stof: Gaslek) Gijsinglaan Rotterdam,179192,170431
12-01-20,05:58:50,P 2,BDH-02,Buitenbrand Judith Leysterstraat Hoefkade,SGRAVH,157830
12-01-20,05:36:52,P 2,BDH-04,Buitenbrand Hofpark,WATERI,156830
12-01-20,05:08:05,P 1,BDH-03,Voertuigbrand Oostblok,DELFT,155430
12-01-20,05:07:25,P 1,BDH-03,Voertuigbrand Oostblok,DELFT,155530
12-01-20,05:03:55,P 1,BDH-02,Voertuigbrand Kokosnootstraat,SGRAVH,157730
12-01-20,05:01:29,P 1,BDH-01,Scheepvaartbrand (middelbrand) Jupiterkade,SGRAVH,155510
12-01-20,05:01:01,P 1,BDH-01,Scheepvaartbrand (middelbrand) Jupiterkade SGRAVH,159599,155481
12-01-20,04:50:46,P 1,BDH-01,Scheepvaartbrand Jupiterkade SGRAVH 157810 157650 159591 156912,157630,155630
12-01-20,04:45:40,P 2,Buitenbrand berm (INCI-01) vv Voc Hazelaarweg,Rotterdam,170761
12-01-20,03:41:56,P 1,Ass. AMBU (INCI-01) (Inzet Brw: RV Afhijsen,til assistentie) Lusthofstraat Rotterdam,170951,170931
12-01-20,01:42:31,P 2,BDH-02,Wateroverlast Troelstrakade,SGRAVH,157770
12-01-20,01:40:16,P 2,BDH-02,Wateroverlast Troelstrakade,SGRAVH,157630
12-01-20,00:54:12,P 2,Nacontrole (INCI-02) Wevershoekstraat,Rotterdam,173431
12-01-20,00:36:57,P 1,BDH-02,Alarm rookmelder Treubstraat,RIJSZH,155630
12-01-20,00:20:29,P 2,BDH-01,Dienstverlening Oudemansstraat,SGRAVH,157630
11-01-20,23:59:46,P 1,Ass. AMBU (INCI-02) (Inzet Brw: aed) Kerkhoekstraat,Hellevoetsluis,172561
11-01-20,23:57:13,P 1,Ass. AMBU (INCI-02) (Inzet Brw: aed) Kerkhoekstraat Hellevoetsluis,172561,172531
11-01-20,23:54:05,P 1,Ass. AMBU (INCI-01) (Inzet Brw: aed) Borneostraat,Vlaardingen,179233
11-01-20,23:52:55,P 2,BDH-02,Buitenbrand Stadhoudersplantsoen,SGRAVH,157230
11-01-20,23:26:26,P 2,Stank/Hinder. Lucht (INCI-01) (chemische lucht) Van Heusdestraat,Rotterdam,179234
11-01-20,23:07:39,P 2,BDH-03,Alarm rookmelder Fritz Langstrook,ZOETMR,159630
11-01-20,23:03:33,P 1,BDH-03,Alarm rookmelder Fritz Langstrook,ZOETMR,155230
11-01-20,23:00:07,P 2,Containerbrand (INCI-02) Regenboog,Rhoon,173231
11-01-20,22:57:33,P 2,CO-melder (INCI-03) Bredehof,Rotterdam,173431
11-01-20,22:53:48,P 2,BDH-02,Buitenbrand 2e Sweelinckstraat,SGRAVH,157830
