30-12-19,18:35:46,P 2,Containerbrand (INCI-04) (Afval) Van der Sluysstraat,Rotterdam,170631
30-12-19,18:24:43,Scenario Proefalarm dienstdoende functionarissen ghor is geactiveerd! Het uitrukbericht staat voor u in,de,alarmeringscomputer
30-12-19,18:16:01,Proefalarm Avond Brandweer Veiligheidsregio,Rotterdam,Rijnmond.
30-12-19,18:15:07,P 2,Containerbrand (INCI-03) (Afval) Josephlaan,Rotterdam,170931
30-12-19,18:12:22,P 2,Buitenbrand (INCI-01) Tidemanstraat,Rotterdam,170631
30-12-19,17:49:09,P 2,BDH-02,Buitenbrand container (papiercontainer) Grashof,LEIDDM,155130
30-12-19,17:40:09,P 2,BDH-01,Stank/Hinder. lucht (vreemde lucht) Stille Putten,DELFT,155530
30-12-19,17:37:58,U bent niet langer actief in de functie Piket_BRW_Hoofdofficier,1,.
30-12-19,17:37:58,U bent nu actief in de functie Piket_BRW_Hoofdofficier,1,.
30-12-19,17:37:33,P 2,Proefalarm Buitenbrand (INCI-01) 17 09 Rotterdam Bosland Bosland Rotterdam,170951,170931
30-12-19,17:31:37,P 1,Gebouwbrand woning (INCI-07) (schoorsteen) Molendijk Den Bommel 185451,174931,174731
30-12-19,17:27:12,P 2,Herbez./Kazern. (INCI-06) Kazerne Mijnsherenlaan,Rotterdam,SK33
30-12-19,17:26:37,Op dit moment is er een opschaling binnen,UW,aandachtsgebied.
30-12-19,17:26:26,P 1,Gebouwbrand woning (INCI-03) (Ops Br: middel) Moerkerkestraat,Rotterdam,179194
30-12-19,17:25:57,P 1,BDH-02,Autom. brand OMS 's Heeren Loo Binnenhof,MONSTR,156730
30-12-19,17:25:03,P 2,Stank/Hinder. Lucht (INCI-05) Hema Sint Jorisplein,Ridderkerk,173831
30-12-19,17:24:40,P 1,Ass. AMBU (INCI-04) (Beknelling) APM Terminals (HN 8203) Coloradoweg Maasvlakte Rotterdam,179195,171431
30-12-19,17:20:59,P 2,BDH-04,Buitenbrand container (papiercontainer) Oude Polderweg Bob Oosthoeklaan,SGRAVH,157430
30-12-19,17:18:52,P 1,Gebouwbrand (INCI-03) Moerkerkestraat Rotterdam,173451,170631
30-12-19,17:17:09,P 2,Buitenbrand afval (INCI-03) Moerkerkestraat,Rotterdam,173431
30-12-19,17:07:19,U bent nu actief in de functie Piket_VRR_Communicatie,VRR,Woordvoerders.
30-12-19,17:07:16,U bent niet langer actief in de functie Piket_VRR_Communicatie,VRR,Woordvoerders.
30-12-19,16:55:20,P 2,Buitenbrand berm (INCI-01) Nieuwlandsedijk bovenlangs Hoek van,Holland,170131
30-12-19,16:42:47,P 2,BDH-10,Liftopsluiting Hildebrandstraat,SGRAVH,157630
30-12-19,16:40:48,P 1,BDH-09,OMS Geverifieerd (brandmelding OMS) Societeit Alcuin Oude Delft,DELFT,155430
30-12-19,16:40:01,P 2,BDH-08,Wateroverlast Debussystraat,DELFT,155530
30-12-19,16:39:05,P 1,BDH-07,Autom. brand OMS Parnassia Psycho-medisch centrum Avocadostraat,SGRAVH,157730
30-12-19,16:38:01,P 1,BDH-02,Gebouwbrand woning (schoorsteen) Westland MOERKP,155250,155330
30-12-19,16:35:27,P 1,BDH-05,Brand bijgebouw (keet/schuurtje) Heereweg,LISSE,159020
30-12-19,16:29:48,P 2,BDH-02,Wateroverlast Z.H.B.-hoven,SGRAVH,159660
30-12-19,16:27:16,P 1,Gebouwbrand woning (INCI-07) (schoorsteen) Aagje Dekenstraat Sommelsdijk 172551,174531,174532
30-12-19,16:22:24,P 1,Gebouwbrand woning (INCI-06) (schoorsteen) Buitendams Hardinxveld-Giessendam,186951,187631
30-12-19,16:21:05,P 2,Buitenbrand berm (INCI-03) Rembrandtstraat,Spijkenisse,173131
30-12-19,16:08:05,P 1,Gebouwbrand (INCI-01) Laurens Maasveld (Afrikaanderwijk) Maashaven O.z. Rotterdam,173451,173731
30-12-19,16:06:07,P 2,Buitensluiting (INCI-05) Grotekerkplein,Rotterdam,170631
30-12-19,16:05:37,P 1,Autom. brand OMS (INCI-01) Laurens Maasveld (Afrikaanderwijk) Maashaven O.z.,Rotterdam,173431
30-12-19,15:58:02,P 1,Gebouwbrand woning (INCI-03) (schoorsteen) Abraham Kuyperlaan Rotterdam,170XXX-XXXXXX,170631
30-12-19,15:55:26,P 1,Gebouwbrand woning (INCI-03) (schoorsteen) Abraham Kuyperlaan Rotterdam,170XXX-XXXXXX,170631
30-12-19,15:49:14,P 2,BDH-04,Nacontrole brand Duitslandlaan,ZOETMR,155230
30-12-19,15:43:39,P 1,BDH-05,OMS Geverifieerd (brandmelding OMS) Delta Lloyd Zorg Johanna Westerdijkplein,SGRAVH,157630
30-12-19,15:43:37,P 2,Containerbrand (INCI-04) (Afval) Ommoordsestraat Fuikstraat,Rotterdam,170931
30-12-19,15:41:31,P 1,BDH-02,Gebouwbrand woning (schoorsteen) Schadeken LEIDDM 155150 159591,155130,157430
30-12-19,15:40:16,P 1,BDH-01,Stank/Hinder. lucht (gaslucht) G.J. van Marrewijklaan,SGRAVH,157730
30-12-19,15:33:22,P 1,Autom. brand OMS (INCI-01) Winkelcentrum Maaswijk Vasalisplein,Spijkenisse,173131
30-12-19,15:23:41,P 2,BDH-04,Buitenbrand container (afvalcontainer) Markensestraat,SGRAVH,157130
30-12-19,15:23:20,P 2,Buitenbrand (INCI-03) Samuel Mullerstraat,Rotterdam,170631
30-12-19,15:16:25,P 1,BDH-01,Autom. brand OMS Spuimarkt Gedempte Gracht,SGRAVH,159635
30-12-19,14:54:33,P 2,Containerbrand (INCI-05) West-Kruiskade,Rotterdam,170631
30-12-19,14:53:17,P 3,Afstemverzoek (INCI-04) (Inzet Brw Log & OnS: td / techn. dienst) MKB Rotterdam Wilhelminakade,Rotterdam,179291
30-12-19,14:41:15,P 2,BDH-02,Buitenbrand container Tholensestraat,SGRAVH,157130
30-12-19,14:37:54,P 1,Autom. brand OMS (INCI-03) Maassilo Creative Factory Maashaven Z.z.,Rotterdam,173431
30-12-19,14:29:31,P 2,BDH-01,Buitenbrand Tomatenstraat Aardbeistraat,SGRAVH,157730
30-12-19,14:15:59,P 1,BDH-20,Ongeval wegvervoer letsel Rijswijkse Waterweg,SGRAVH,159660
30-12-19,14:11:40,P 2,BDH-06,Buitenbrand container (afvalcontainer) Schimmelweg,SGRAVH,157630
30-12-19,14:10:03,P 2,BDH-01,Buitenbrand berm/ruigte De Ruyterstraat,LEIDDM,155130
30-12-19,14:03:09,P 2,Containerbrand (INCI-01) (Afval) Nieuwe Kerkplaats,Vlaardingen,179232
30-12-19,14:01:56,P 1,BDH-05,OMS Geverifieerd (brandmelding OMS) Jorplace Keizerstraat,SGRAVH,157130
30-12-19,13:58:37,P 3,Afstemverzoek (Inzet/afst. Brw Func: BvD) 17 35 Rotterdam Plesmanweg SI Albert,Plesmanweg,Rotterdam
,,30-12-19,13:51:16,t_HO_HMR.
30-12-19,13:51:15,U bent nu actief in de,functie,Pike
30-12-19,13:51:15,U bent niet langer actief in de,functie,Piket_HO_HMR.
30-12-19,13:42:44,P 1,BDH-03,Gebouwbrand woning Hugo de Grootstraat SGRAVH 157850 159591 157230,159635,159660
30-12-19,13:41:44,A1 Strand Noord SGRAVH : (lifeguards,,pat.,vervoer)
30-12-19,13:41:03,P 2,Ass. AMBU (INCI-09) (Inzet Brw: RV Afhijsen) Hoeksekade Bergschenhoek,170XXX-XXXXXX,170731
30-12-19,13:34:35,P 2,BDH-02,Wateroverlast Diamant,ZOETMR,155230
30-12-19,13:32:07,P 2,BDH-01,Buitenbrand container Hennegras,SGRAVH,155430
30-12-19,13:28:14,U bent nu actief in de functie Piket,TCO,Coordinator.
30-12-19,13:28:14,U bent niet langer actief in de functie Piket,TCO,Coordinator.
30-12-19,13:25:14,P 1,Ass. AMBU (INCI-08) Erasmuslaan,Ridderkerk,173831
30-12-19,13:17:32,P 2,Stank/Hinder. Lucht (INCI-06) (Aantr.: vreemde lucht) Noordeinde,Zwartewaal,172731
30-12-19,13:03:58,P 2,Ass. AMBU (INCI-01) (Etage: 1) (Inzet Brw: RV Afhijsen) Brigantijnstraat,Rotterdam,170XXX-XXXXXX
30-12-19,12:58:59,P 1,Ass. AMBU (INCI-05) Rigapad Rotterdam,172561,173631
30-12-19,12:52:59,P 1,Ongeval wegvervoer letsel (INCI-03) Vondelingenweg butaanweg Pernis Rotterdam,179195,172131
30-12-19,12:49:03,P 2,BDH-04,Stank/Hinder. lucht (vreemde lucht) Prinsen en Prinsessen Willem Dreeslaan,ZOETMR,155330
30-12-19,12:38:54,P 2,Afstemverzoek (INCI-03) MKB Rotterdam Wilhelminakade,Rotterdam,179291
30-12-19,12:36:20,P 1,BDH-03,BR beheerssysteem OMS Haaglanden Megastore Van der Kunstraat,SGRAVH,157630
30-12-19,12:32:56,Ingetrokken AlarmAutom. brand OMS (INCI-05) Havenhoofd App. Reuchlinhaven,Barendrecht,173631
30-12-19,12:28:31,P 1,Autom. brand OMS (INCI-05) Havenhoofd App. Reuchlinhaven Barendrecht,172561,173631
30-12-19,12:23:10,P 2,Buitenbrand (INCI-04) Repel,Hellevoetsluis,172531
30-12-19,11:59:29,P 1,Ass. AMBU (INCI-02) (Inzet Brw: aed) Gerard Doustraat Capelle aan den,IJssel,171151
30-12-19,11:56:52,4 Aantref. explosieven zie omschrijving kladblok Maasvlakte Rotterdam,ICnum,641181
30-12-19,11:55:24,P 2,Containerbrand (INCI-03) Hofdijksweg Vliedberglaan,Ouddorp,173931
30-12-19,11:54:18,P 1,Ass. AMBU (INCI-02) (Inzet Brw: aed) Gerard Doustraat Capelle aan den,IJssel,171131
30-12-19,11:44:10,P 2,BDH-20,Wateroverlast Loevesteinlaan,SGRAVH,159660
30-12-19,11:40:00,P 3,Afstemverzoek (INCI-02) GMK Rotterdam Wilhelminakade,Rotterdam,179291
30-12-19,11:28:18,P 2,Dier in problemen (INCI-01) Peitkreek Rotterdam,173751,173731
30-12-19,11:14:50,P 2,BDH-03,Liftopsluiting Noordlandseweg,SGRAVZ,170131
30-12-19,11:04:22,P 1,BDH-02,Ass. ambu (afhijsen patient) Prinses Beatrixlaan RIJSZH,157650,155630
30-12-19,10:49:46,TS 171031 is weer inzetbaar herbezetting,mag,retour
30-12-19,10:48:50,TS 171131 is weer inzetbaar herbezetting,mag,retour
30-12-19,10:24:11,U bent nu actief in de functie Piket_GHOR_Hoofd,Actie,Centrum.
30-12-19,10:06:44,OEFENING P 1,Drukknopmelding (INCI-02) ENGIE Energie Nederland NV Missouriweg Maasvlakte,Rotterdam,171431
30-12-19,09:37:13,P 1,Brand wegvervoer (INCI-07) (personenauto) N15 Re Europaweg 25.7-26.1 Zuidbaan 24,0 Europoort Rotterdam,171431,171531
30-12-19,09:37:01,P 1,BDH-02,Autom. brand OMS Mappa Mondo Haaglanden Huis te Landelaan,RIJSZH,157630
30-12-19,09:00:31,P 2,Herbez./Kazern. (INCI-05) Kazerne Bosland,Rotterdam,SK33
30-12-19,08:58:54,Het scenario Grote Brand /Hulpverlening is gestart,het bericht staat voor u klaar in,de,alarmeringscomputer.
30-12-19,08:58:34,Het scenario Grote Brand /Hulpverlening is gestart,het bericht staat voor u klaar in,de,alarmeringscomputer.
30-12-19,08:55:35,P 2,Herbez./Kazern. (INCI-04) Kazerne Capelle aan den IJssel Capelle aan den,IJssel,SK05
30-12-19,08:54:11,P 1,Gebouwbrand woning (INCI-01) (Ops Br: groot) (keuken) Kelloggplaats Rotterdam 179021 179091 179094 179981 179098 179081,170931,171692
30-12-19,08:53:01,P 2,Herbez./Kazern. (INCI-03) Kazerne Metaalhof,Rotterdam,SK11
30-12-19,08:50:09,Op dit moment is er een opschaling binnen,UW,aandachtsgebied.
30-12-19,08:50:03,P 1,Gebouwbrand woning (INCI-01) (Ops Br: middel) (keuken) Kelloggplaats,Rotterdam,179193
30-12-19,08:46:33,P 1,Ass. AMBU (INCI-02) (Inzet Brw: RV Afhijsen) Oostsingel,Schiedam,170XXX-XXXXXX
30-12-19,08:43:48,U bent niet langer actief in de functie Piket_GHOR_Operationeel Directeur,GHOR,.
30-12-19,08:39:40,test Buitenbrand (INCI-02) Baan,Rotterdam,170631
30-12-19,08:37:18,P 1,Gebouwbrand (INCI-01) Kelloggplaats Rotterdam 171151,171031,171131
30-12-19,08:31:49,U bent nu actief in de functie Piket_VRR_Ondersteuner sectie,communicatie,.
30-12-19,08:31:49,U bent niet langer actief in de functie Piket_VRR_Ondersteuner sectie,communicatie,.
30-12-19,08:30:52,Proefalarm Ochtend Brandweer Veiligheidsregio,Rotterdam,Rijnmond.
30-12-19,08:30:33,Proefalarm Ochtend Brandweer Veiligheidsregio,Rotterdam,Rijnmond.
30-12-19,08:25:09,U bent niet langer actief in de,functie,Piket_VRR_Directiewacht.
30-12-19,08:00:49,U bent niet langer actief in de functie Piket_GHOR_Operationeel medewerker,actiecentrum,.
30-12-19,07:44:57,P 1,BDH-01,Autom. brand OMS Nutricia Gerard Doustraat,ZOETMR,155230
30-12-19,07:40:05,VERVALLEN!!! Autom. brand OMS BEURS - WTC,Meent,Rotterdam
30-12-19,07:38:31,P 1,Autom. brand OMS (INCI-01) BEURS - WTC Meent,Rotterdam,170631
30-12-19,07:17:37,P 1,BDH-20,Alarm rookmelder van Arembergelaan,VOORB,159660
30-12-19,06:37:20,P1 Autom. brand OMS (INCI-03) Sint Chatharijnekerk Sint Catharijnehof,Brielle,172631
30-12-19,06:20:24,P 2,BDH-02,CO-melder (koolmonoxide/CO) Nicolaistraat,SGRAVH,157230
30-12-19,05:56:23,P 1,BDH-02,Voertuigbrand Edamstraat Leyweg,SGRAVH,157730
30-12-19,05:30:54,P 2,Herbez./Kazern. (INCI-08) Kazerne Elbeweg Maasvlakte,Rotterdam,SK17
30-12-19,05:21:58,P 1,BDH-01,Autom. brand OMS Penitentiaire Inr. Haaglanden Pompstationsweg SGRAVH 159670 159591,157130,157230
30-12-19,05:18:43,P 2,Gebouwbrand (INCI-02) (Ops Br: groot) (Inzet Brw Log & OnS: vz-ah / arbeidshyg) Kralingseweg,Rotterdam,179201
30-12-19,05:12:56,P 1,Verontreiniging lucht (INCI-05) (CIN G1) Indorama Rotterdam (Hn6347) Markweg Europoort Rotterdam 179195 178792 179022,179023,171531
30-12-19,05:04:16,P 1,Gebouwbrand (Ops Br: groot),Kralingseweg,Rotterdam
30-12-19,05:03:26,Het scenario Grote Brand /Hulpverlening is gestart,het bericht staat voor u klaar in,de,alarmeringscomputer.
30-12-19,04:58:45,Het scenario Grote Brand /Hulpverlening is gestart,het bericht staat voor u klaar in,de,alarmeringscomputer.
30-12-19,04:58:29,Het scenario Grote Brand /Hulpverlening is gestart,het bericht staat voor u klaar in,de,alarmeringscomputer.
30-12-19,04:54:33,P 2,Herbez./Kazern. (INCI-03) Kazerne Capelle aan den IJssel Capelle aan den,IJssel,SK05
30-12-19,04:53:31,P 1,Gebouwbrand (INCI-02) (Ops Br: groot) Kralingseweg Rotterdam 179091 179094 179981 179098 179081,171132,171692
30-12-19,04:50:57,P 1,Gebouwbrand (INCI-02) (Ops Br: middel) Kralingseweg,Rotterdam,179021
30-12-19,04:50:54,P 2,Herbez./Kazern. (INCI-04) Kazerne Metaalhof,Rotterdam,SK07
30-12-19,04:49:41,P 2,Herbez./Kazern. (INCI-03) Kazerne Capelle aan den IJssel Capelle aan den,IJssel,SK11
30-12-19,04:45:44,Op dit moment is er een opschaling binnen,UW,aandachtsgebied.
30-12-19,04:44:54,P 1,Gebouwbrand (INCI-02) (Ops Br: middel) Kralingseweg,Rotterdam,179193
30-12-19,04:37:29,P 1,Gebouwbrand (INCI-02) Kralingseweg Capelle aan den IJssel 171151,171131,171031
30-12-19,04:26:01,P 1,Brand wegvervoer (INCI-01) (personenauto) Tapuitstraat,Rotterdam,173561
30-12-19,02:55:11,P 1,BDH-01,Autom. brand OMS Prinsenhof E-toren Prinses Margrietplantsoen,SGRAVH,157430
30-12-19,02:00:08,P 2,BDH-01,Buitenbrand Sint Jorisweg,DELFT,155530
30-12-19,01:09:35,P2 TS 7130,Info,BV
30-12-19,00:42:41,P 2,Wateroverlast (INCI-05) Dirkslandhof,Rotterdam,173561
30-12-19,00:34:03,P 2,BDH-02,Buitenbrand container (afvalcontainer) Jan van Riebeekplein,SGRAVH,157430
30-12-19,00:30:16,P 2,Buitenbrand (INCI-04) Vroesenlaan,Rotterdam,170331
30-12-19,00:24:01,P 2,Wateroverlast (INCI-01) van Leeuwenhoekstraat,Vlaardingen,179232
30-12-19,00:11:46,P 2,BDH-03,Buitenbrand Klein Arentsburghstraat,VOORB,155630
29-12-19,23:58:42,P2 Inzet TS 7130,info,BV
29-12-19,23:48:44,P 1,BDH-05,Buitenbrand Fonteynenburghlaan,VOORB,155630
29-12-19,23:46:42,P 2,BDH-03,Buitenbrand Anna Blamanplein,SGRAVH,157630
29-12-19,23:45:33,P 1,Ass. AMBU (INCI-02) Hollemarestraat,Zwartewaal,172731
29-12-19,23:40:20,P 2,BDH-06,CO-melder (koolmonoxide/CO) Van Catshuysenstraat,WATERI,156830
29-12-19,23:30:14,P 2,BDH-04,Buitenbrand afval/rommel Soestdijkseplein,SGRAVH,157630
29-12-19,23:21:57,P 2,BDH-02,Buitenbrand Lijsterbesstraat,SGRAVH,159635
29-12-19,23:04:41,P 1,Brand wegvervoer (INCI-05) (scooter) Total Prinsenlaan Prinsenlaan,Rotterdam,170931
29-12-19,23:03:28,P 1,Ass. AMBU (INCI-01) (Inzet Brw: RV Afhijsen) Ernest Claespad Rotterdam,171151,171031
29-12-19,22:45:46,P 2,BDH-03,Buitenbrand Agatha,LEIDDM,155130
29-12-19,22:41:48,P 2,BDH-02,Buitenbrand Soestdijkseplein Zuiderparklaan,SGRAVH,159635
29-12-19,22:38:42,P 2,Containerbrand (INCI-04) (Afval) Campusplein Hoogvliet,Rotterdam,172231
29-12-19,22:36:18,P 1,BDH-01,Gebouwbrand woning Lekstroom,ZOETMR,159591
29-12-19,22:29:33,P 1,BDH-01,Gebouwbrand woning Lekstroom ZOETMR 155250 159591,155330,162236
29-12-19,22:18:08,P 1,BDH-08,Voertuigbrand Hoogveen,SGRAVH,157730
29-12-19,22:17:14,P 2,BDH-07,Buitenbrand container Tienhovenselaan Escamplaan,SGRAVH,157730
29-12-19,22:09:54,P 2,BDH-06,Buitenbrand container (afvalcontainer) Delftselaan,SGRAVH,159635
29-12-19,22:07:04,P 1,BDH-04,Gebouwbrand onderwijs De Trampoline De Haar LEIDDM 155150 159591,155130,164430
29-12-19,21:59:50,P 2,BDH-03,Buitenbrand container Hoogkarspelstraat,SGRAVH,157730
29-12-19,21:56:18,P 2,BDH-05,Buitenbrand container Van der Woudendijk Van Campenvaart,SGRAVH,155630
29-12-19,21:55:54,P 2,BDH-20,Buitenbrand afval/rommel Vissershavenweg,SGRAVH,157130
29-12-19,21:55:18,P 2,BDH-03,Buitenbrand Azieweg,ZOETMR,155230
29-12-19,21:52:07,P 1,Gebouwbrand woning (INCI-03) (schoorsteen) Boezemsingel,Oud-Beijerland,185451
29-12-19,21:46:57,P 1,Gebouwbrand (INCI-03) Boezemsingel,Oud-Beijerland,185432
29-12-19,21:46:33,P 2,Wateroverlast (INCI-01) Van Lennepstraat,Rotterdam,170431
29-12-19,21:39:40,P 1,BDH-04,Voertuigbrand Delftweg,RIJSZH,155530
29-12-19,21:36:47,P 2,BDH-01,Buitenbrand container Spruitkoolakker,ZOETMR,155330
29-12-19,21:31:50,P 2,BDH-02,Buitenbrand afval/rommel Rosa Parkspad,SGRAVH,157730
29-12-19,21:27:52,P 2,BDH-05,Buitenbrand Prinses Irenelaan Min Van den Tempellaan,RIJSZH,155630
29-12-19,21:24:31,P 2,BDH-03,Buitenbrand afval/rommel Azieweg,ZOETMR,155230
29-12-19,21:22:57,P 2,BDH-08,Buitenbrand container Egyptelaan,DELFT,155530
29-12-19,21:14:46,P 2,Buitenbrand (INCI-04) Marinus Batenburgplein,Rotterdam,171132
29-12-19,21:09:44,P 2,BDH-02,Buitenbrand container Nieuw Waldeck Toscaninistraat,SGRAVH,157730
29-12-19,21:05:33,P 2,BDH-06,Liftopsluiting Cesar Franckstraat,DELFT,156030
29-12-19,21:05:01,P 2,BDH-04,Buitenbrand container Galvanistraat,SGRAVH,159635
29-12-19,21:03:24,P 2,BDH-03,Buitenbrand Johan van Oldenbarneveldtstraat,HONSDK,156630
29-12-19,21:02:44,P 2,Containerbrand (INCI-03) Hoflaan,Middelharnis,174531
29-12-19,21:00:09,P 2,BDH-01,Buitenbrand container Reggestraat,SGRAVH,157230
29-12-19,20:56:48,P 1,Gebouwbrand (INCI-02) Eliotplaats Rotterdam 171151,171031,171131
29-12-19,20:55:50,P 2,Buitenbrand afval (INCI-01) Waalhaven N.z.,Rotterdam,173561
29-12-19,20:50:46,P 2,BDH-05,Buitenbrand container Willem Dreeslaan Alkstraat,DELFT,155530
29-12-19,20:40:27,P 1,BDH-04,Autom. brand OMS Middin - Heemburgh Schiebroekstraat,ZOETMR,155330
29-12-19,20:39:03,P 2,BDH-03,Ass. politie Van Loostraat,SGRAVH,157150
29-12-19,20:37:53,P 2,BDH-02,Dienstverlening Anslostraat,SGRAVH,157630
29-12-19,20:33:54,P 2,BDH-01,Buitenbrand berm/ruigte Dallashof,SGRAVH,157730
29-12-19,20:14:29,P 2,Containerbrand (INCI-04) Koningin Emmaboulevard Hoek van,Holland,170131
29-12-19,20:03:14,P 2,BDH-02,Nacontrole brand Schoolstraat,RIJSZH,155630
29-12-19,20:00:54,P 1,Ass. AMBU (INCI-03) (Inzet Brw: aed) Zernikeplaats,Rotterdam,171031
29-12-19,19:55:31,P 2,Containerbrand (INCI-02) Albert van Raalteplein,Schiedam,170432
29-12-19,19:54:11,P 1,BDH-10,Buitenbrand Afrikalaan Decimastraat,DELFT,155530
29-12-19,19:52:01,P 1,Ass. AMBU (:!vervallen!: ),Lindendreef,Bleiswijk
29-12-19,19:50:12,P 1,Ass. AMBU (INCI-01) Lindendreef,Bleiswijk,170831
29-12-19,19:47:54,P 2,BDH-06,Buitenbrand MFA Het Lint Achterdijkshoorn,DENHZH,156030
29-12-19,19:41:22,P 2,BDH-02,Buitenbrand afval/rommel (afvalcontainer) Zandeveltplein,SGRAVZ,156530
29-12-19,19:40:50,P 2,BDH-01,Buitenbrand afval/rommel Koornbranderstraat Chirurgijnstraat,DELFGW,155430
29-12-19,19:28:55,P 2,BDH-07,Buitenbrand Bleijenburg,DELIER,156930
29-12-19,19:27:31,P 2,BDH-06,Buitenbrand container (papiercontainer) Goeverneurlaan,SGRAVH,157630
29-12-19,19:26:59,P 1,BDH-05,Buitenbrand container Zeeltsloot,ZOETMR,155230
29-12-19,19:24:30,P 2,BDH-04,Buitenbrand container Van Twiskwater,SGRAVH,155630
29-12-19,19:21:24,P 2,BDH-03,Buitenbrand container Tasmanstraat,SGRAVH,159635
29-12-19,19:17:13,P 2,BDH-01,Buitenbrand Bevelandsestraat Vlielandsestraat,SGRAVH,157130
29-12-19,19:15:11,P 2,Herbez./Kazern. (INCI-09) Kazerne Capelle aan den IJssel Capelle aan den,IJssel,SK11
29-12-19,19:07:03,P 1,Ass. AMBU (INCI-08) (Inzet Brw: aed) Jacques Dutilhweg,Rotterdam,171131
29-12-19,19:04:52,P 2,Ass. Politie (INCI-07) De Manstraat,Rotterdam,17INC
29-12-19,18:54:05,P 2,BDH-02,Buitenbrand Gravendreef De Dreef,SGRAVH,157730
29-12-19,18:52:05,P 2,Containerbrand (INCI-05) Bas Jungeriusstraat,Rotterdam,173431
29-12-19,18:51:50,P 2,BDH-01,Stank/Hinder. lucht (koolmonoxide/CO) De Genestetlaan,SGRAVH,157630
29-12-19,18:39:25,P 1,BDH-02,Autom. brand OMS Stichting Horizon Monsterseweg,SGRAVH,157730
29-12-19,18:32:05,P 2,Containerbrand (INCI-04) Hillevliet maranatha kerk,Rotterdam,173431
29-12-19,18:28:48,P 2,BDH-01,Buitenbrand container Ooststraat,SGRAVH,157130
29-12-19,18:17:03,P 2,Buitenbrand (INCI-01) Branding,Hellevoetsluis,172531
29-12-19,18:14:42,P 1,BDH-01,Autom. brand OMS Woodstock Om-en-Bij,SGRAVH,159635
29-12-19,17:31:27,P 2,Containerbrand (INCI-05) Ringvaartweg,Rotterdam,171031
29-12-19,17:27:31,P 2,Buitenbrand (INCI-04) Spanjaardstraat,Rotterdam,170631
29-12-19,17:15:10,P 1,BDH-03,Stank/Hinder. lucht (gaslucht) Lozerlaan,SGRAVH,157750
29-12-19,17:11:11,P 1,BDH-02,Gebouwbrand Aanleunwoningen Thuishaven Seinpoststraat SGRAVH 157150 159591,157130,157230
29-12-19,17:10:01,P 2,BDH-01,Buitenbrand container Aronskelkweg Hoefbladlaan,SGRAVH,157730
29-12-19,17:04:57,P 1,Ongeval (Aantr.: gaslucht),Hoepelmaker,Spijkenisse
29-12-19,17:03:16,P 1,Autom. brand OMS (INCI-03) Parkeergarage George Hintzenweg,Rotterdam,171031
29-12-19,16:58:57,P 1,Ongeval (INCI-02) (Aantr.: gaslucht) Hoepelmaker Spijkenisse,179199,173131
29-12-19,16:47:58,P 1,Handmelder OMS (INCI-05) Stichting Aafje De Nieuwe Plantage Weteringstraat,Rotterdam,170931
29-12-19,16:47:46,P 2,Containerbrand (INCI-04) De Manstraat,Rotterdam,173431
29-12-19,16:46:05,P 1,Autom. brand OMS (INCI-03) Schiecentrale Lloydstraat,Rotterdam,170631
29-12-19,16:43:46,P 2,BDH-03,Buitenbrand container (kledingcontainer) Carry van Bruggenhove,ZOETMR,155230
29-12-19,16:39:33,P 2,BDH-02,Buitenbrand Melodiestraat,SGRAVH,157730
29-12-19,16:24:03,P 1,Brand wegvervoer (INCI-02) (vrachtwagen) Schaapherderweg,Ridderkerk,173731
29-12-19,16:18:10,Prio 2 N468 - Molenweg Prinses Beatrixlaan MAASLD Overlast,van/door,jeugd
29-12-19,16:06:16,P 2,Containerbrand (INCI-04) Riederstraat,Rotterdam,173431
29-12-19,16:05:03,P 2,BDH-01,Buitenbrand container Melis Stokelaan,SGRAVH,157730
29-12-19,15:54:07,P 1,BDH-03,Liftopsluiting Cesar Franckstraat,DELFT,155530
29-12-19,15:50:50,P 1,Ongeval (INCI-03) (Aantr.: gaslucht) Kwartslaan Rhoon,179194,172561
29-12-19,15:50:16,P 1,Ass. AMBU (INCI-01) (Inzet Brw: aed) Ring,Simonshaven,173031
29-12-19,15:34:24,P 1,BDH-03,Autom. brand OMS Hotel de Sniep Broekwegschouw,ZOETMR,155230
29-12-19,15:32:42,P 2,BDH-02,Liftopsluiting KPN Telecom Prinses Beatrixlaan,SGRAVH,157430
29-12-19,15:20:54,P 2,Buitenbrand berm (INCI-01) Boulevard naast het strandje Rozenburg,ZH,171731
29-12-19,15:03:57,P 2,Containerbrand (INCI-04) Oldegaarde,Rotterdam,173561
29-12-19,14:35:10,P 2,Containerbrand (INCI-01) H W Croeslaan,Vierpolders,172731
29-12-19,14:20:59,P 2,Liftopsluiting (INCI-03) Zuidplein Hoog,Rotterdam,173431
29-12-19,14:15:44,P 2,BDH-01,Buitenbrand container Martin Luther Kinglaan Folke Bernadottestraat,SGRAVH,157730
29-12-19,14:05:37,P 1,Ass. AMBU (INCI-01) (Inzet/afst. Brw Func: OvDB) Pruimendijk,Ridderkerk,179194
29-12-19,14:05:14,P 1,Ass. AMBU (INCI-01) Pruimendijk,Ridderkerk,173831
29-12-19,13:55:40,P 2,BDH-02,Buitenbrand Bronsgroen,ZOETMR,155330
29-12-19,13:24:31,P 2,Containerbrand (INCI-01) Kwelder,Hendrik-Ido-Ambacht,186431
29-12-19,13:22:14,P 1,BDH-02,Gebouwbrand woning Haagweide SGRAVH 157650 159591,157630,159635
29-12-19,12:50:52,P 2,Buitenbrand (INCI-01) Borselaarstraat,Rotterdam,173431
29-12-19,12:43:03,P 2,BDH-01,Buitenbrand Belvederebos,ZOETMR,155230
29-12-19,12:35:28,U bent nu actief in de functie Piket_BRW_Tactisch Officier,Alarmcentrale,.
29-12-19,12:35:28,U bent niet langer actief in de functie Piket_BRW_Tactisch Officier,Alarmcentrale,.
29-12-19,12:34:37,P 2,Autom. brand OMS (INCI-01) Drieenhuyzen Willem de Zwijgerlaan,Vlaardingen,179232
29-12-19,12:28:54,P 2,Containerbrand (INCI-02) Muskuskruid,Vlaardingen,179232
29-12-19,12:02:22,P 1,Autom. brand OMS (INCI-03) Stadhuis Oude Grote Markt,Schiedam,170431
29-12-19,11:57:52,P 1,Autom. brand OMS (INCI-02) Middin Schulpplein Rotterdam,173561,173431
29-12-19,11:44:03,P 1,BDH-01,Autom. brand OMS Waldeckstate Strausslaan,SGRAVH,157730
29-12-19,11:40:44,P 2,BDH-03,Buitenbrand container de Tol,LEIDDM,155130
29-12-19,10:31:50,P 2,BDH-02,Buitenbrand container (papiercontainer) Oude Polderweg,SGRAVH,157430
29-12-19,09:46:47,U bent niet langer actief in de functie Piket_VRR_Hoofd,sectie,communicatie.
29-12-19,09:46:47,U bent nu actief in de functie Piket_VRR_Hoofd,sectie,communicatie.
29-12-19,09:10:50,P 1,BDH-04,Ongeval wegvervoer letsel A4 Li 38,9,LEIDDM,159670
29-12-19,09:08:18,P 1,BDH-04,Ongeval wegvervoer letsel A4 Li 38,9 LEIDDM,159591,155130
29-12-19,08:51:26,P 2,BDH-03,Ass. ambu (afhijsen patient) Oranjeplein SGRAVH,157850,159635
29-12-19,08:30:46,Proefalarm Ochtend Brandweer Veiligheidsregio,Rotterdam,Rijnmond.
29-12-19,06:59:46,P 2,BDH-02,Buitenbrand container (papiercontainer) Pietersonstraat,TRHEIE,156730
29-12-19,06:17:50,P 2,BDH-01,Liftopsluiting Sir Winston Center Generaal Eisenhowerplein,RIJSZH,155630
29-12-19,06:14:24,P 1,Handmelder OMS (INCI-02) WZC Slinge Slinge Rotterdam,172561,173431
29-12-19,06:04:03,##SETTIME,06:04:00,29-12-2019##
29-12-19,05:42:50,P 1,Autom. brand OMS (INCI-02) De Zeester KDV Eendrachtsplein,Rotterdam,170631
29-12-19,05:38:48,P 2,BDH-02,Buitenbrand container (papiercontainer) Louis Davidsstraat,SGRAVH,157730
29-12-19,05:24:03,P 2,BDH-03,Buitenbrand container (afvalcontainer) Mulder Sport Loevesteinlaan,SGRAVH,157630
29-12-19,05:13:29,P 2,BDH-02,Buitenbrand container Oude Polderweg Gorterlaan,SGRAVH,157430
29-12-19,05:04:03,P 2,BDH-01,Buitenbrand container Steentijdsingel,SGRAVH,155630
29-12-19,04:39:01,P 1,Gebouwbrand woning (INCI-02) Aegidiusstraat Rotterdam 170951,170931,170631
29-12-19,04:28:40,P 1,BDH-02,Autom. brand OMS Stichting Anton Constandse Gouwestraat,SGRAVH,157230
29-12-19,03:57:05,P 2,BDH-05,Buitenbrand container Smitsdijk,SGRAVH,155530
29-12-19,03:56:44,P 1,BDH-04,Ongeval wegvervoer letsel Melis Stokelaan Aagje Dekenlaan SGRAVH,159592,157630
29-12-19,03:46:29,P 1,Brand wegvervoer (INCI-01) (personenauto) Hilledwarsstraat,Rotterdam,170631
29-12-19,03:43:52,P 1,BDH-03,Gebouwbrand logies Hotel Bastion Den Haag/Rijswijk Polakweg RIJSZH 157650 159591,155630,157630
29-12-19,03:40:26,P 2,BDH-02,Buitenbrand container (papiercontainer) Boeroestraat Ternatestraat,DELFT,155530
29-12-19,03:39:52,P 2,BDH-01,Buitenbrand container Vissershavenweg,SGRAVH,157130
29-12-19,02:36:11,P 1,BDH-01,OMS Geverifieerd (brandmelding OMS) Krit 2 Parkeergarage Plein Plein,SGRAVH,157230
29-12-19,02:08:20,P 1,BDH-05,Voertuigbrand Erasmusweg Van Ruysbroekstraat,SGRAVH,157630
29-12-19,02:08:02,P 2,BDH-04,Buitenbrand container Steentijdsingel,SGRAVH,155630
29-12-19,02:07:03,P 1,BDH-02,Voertuigbrand Malisingel Zambiapad,DELFT,155530
29-12-19,01:56:03,P 2,Buitenbrand afval (INCI-04) Broekweg,Vlaardingen,179232
